3870,"Dumpling, potato- or cheese-filled, frozen",,,0.9,,,,
3871,"T.G.I. FRIDAY'S, chicken fingers, from kids' menu",,,0.9,,,,
3872,"APPLEBEE'S, fish, hand battered",,,0.9,,,,
3873,"Restaurant, family style, fish fillet, battered or breaded, fried",,,0.9,,,,
3874,"Restaurant, family style, chicken tenders",,,0.9,,,,
3875,"CARRABBA'S ITALIAN GRILL, chicken parmesan without cavatappi pasta",,,0.9,,,,
3876,"OLIVE GARDEN, chicken parmigiana without pasta",,,0.9,,,,
3877,"Restaurant, Italian, chicken parmesan without pasta",,,0.9,,,,
3878,"Restaurant, Chinese, general tso's chicken",,,0.9,,,,
3879,"Restaurant, Chinese, chicken and vegetables",,,0.9,,,,
3880,"Ice creams, chocolate, rich",,,0.9,,,,
3881,"Puddings, all flavors except chocolate, low calorie, regular, dry mix",,,0.9,,,,
3882,"Milk, chocolate, fluid, commercial, whole, with added vitamin A and vitamin D",,,0.8,,,,
3883,"Ice cream, bar or stick, chocolate covered",,,0.8,,,,
3884,"Babyfood, peaches, dices, toddler",,,0.8,,,,
3885,"Babyfood, dinner, turkey, rice, and vegetables, toddler",,,0.8,,,,
3886,"Babyfood, cereal, mixed, prepared with whole milk",,,0.8,,,,
3887,"Salad dressing, thousand island, commercial, regular",,,0.8,,,,
3888,"Salad dressing, honey mustard dressing, reduced calorie",,,0.8,,,,
3889,"Soup, chunky chicken noodle, canned, ready-to-serve",,,0.8,,,,
3890,"Soup, minestrone, canned, condensed",,,0.8,,,,
3891,"Soup, tomato bisque, canned, condensed",,,0.8,,,,
3892,"Soup, HEALTHY CHOICE Chicken Noodle Soup, canned",,,0.8,,,,
3893,"Soup, HEALTHY CHOICE Chicken and Rice Soup, canned",,,0.8,,,,
3894,"Soup, chicken gumbo, canned, prepared with equal volume water",,,0.8,,,,
3895,"Soup, vegetable beef, canned, prepared with equal volume water",,,0.8,,,,
3896,"Cereals ready-to-eat, POST, FRUITY PEBBLES",,,0.8,,,,
3897,"Cereals, corn grits, white, regular and quick, enriched, cooked with water, without salt",,,0.8,,,,
3898,"Cereals, farina, enriched, assorted brands including CREAM OF WHEAT, quick (1-3 minutes), cooked with water, without salt",,,0.8,,,,
3899,"Cereals, corn grits, white, regular and quick, enriched, cooked with water, with salt",,,0.8,,,,
3900,"Cereals, farina, enriched, cooked with water, with salt",,,0.8,,,,
3901,"Cherries, sour, red, canned, light syrup pack, solids and liquids",,,0.8,,,,
3902,"Cherries, sour, red, canned, extra heavy syrup pack, solids and liquids",,,0.8,,,,
3903,"Melons, honeydew, raw",,,0.8,,,,
3904,"Pineapple, canned, water pack, solids and liquids",,,0.8,,,,
3905,"Pineapple, canned, juice pack, solids and liquids",,,0.8,,,,
3906,"Pineapple, canned, light syrup pack, solids and liquids",,,0.8,,,,
3907,"Pineapple, canned, heavy syrup pack, solids and liquids",,,0.8,,,,
3908,"Pineapple, canned, extra heavy syrup pack, solids and liquids",,,0.8,,,,
3909,"Mung beans, mature seeds, sprouted, cooked, boiled, drained, without salt",,,0.8,,,,
3910,"Potatoes, mashed, dehydrated, prepared from flakes without milk, whole milk and butter added",,,0.8,,,,
3911,"Soybeans, mature seeds, sprouted, cooked, steamed",,,0.8,,,,
3912,"Beets, pickled, canned, solids and liquids",,,0.8,,,,
3913,"Beans, mung, mature seeds, sprouted, canned, drained solids",,,0.8,,,,
3914,"Carrot juice, canned",,,0.8,,,,
3915,"Mung beans, mature seeds, sprouted, cooked, boiled, drained, with salt",,,0.8,,,,
3916,"Peppers, sweet, red, frozen, chopped, boiled, drained, without salt",,,0.8,,,,
3917,"Peppers, sweet, red, frozen, chopped, boiled, drained, with salt",,,0.8,,,,
3918,"Soybeans, mature seeds, sprouted, cooked, steamed, with salt",,,0.8,,,,
3919,"Beverages, dairy drink mix, chocolate, reduced calorie, with aspartame, powder, prepared with water and ice",,,0.8,,,,
3920,Soy sauce made from soy and wheat (shoyu),,,0.8,,,,
3921,Soy sauce made from soy (tamari),,,0.8,,,,
3922,"Vitasoy USA, Organic Nasoya Firm Tofu",,,0.8,,,,
3923,"Soymilk (All flavors), lowfat, with added calcium, vitamins A and D",,,0.8,,,,
3924,"SILK Chocolate, soymilk",,,0.8,,,,
3925,"SILK Light Chocolate, soymilk",,,0.8,,,,
3926,"SILK Plus for Bone Health, soymilk",,,0.8,,,,
3927,"Vitasoy USA Organic Nasoya, Tofu Plus Firm",,,0.8,,,,
3928,HOUSE FOODS Premium Soft Tofu,,,0.8,,,,
3929,"Bread, stuffing, dry mix, prepared",,,0.8,,,,
3930,"Cake, pineapple upside-down, prepared from recipe",,,0.8,,,,
3931,"Cake, white, prepared from recipe without frosting",,,0.8,,,,
3932,"Cookies, butter, commercially prepared, enriched",,,0.8,,,,
3933,"Cream puff shell, prepared from recipe",,,0.8,,,,
3934,"Doughnuts, yeast-leavened, with creme filling",,,0.8,,,,
3935,"Pie, cherry, commercially prepared",,,0.8,,,,
3936,"Pie, chocolate creme, commercially prepared",,,0.8,,,,
3937,"Pie, peach",,,0.8,,,,
3938,"Cookies, butter, commercially prepared, unenriched",,,0.8,,,,
3939,"Snacks, corn-based, extruded, puffs or twists, cheese-flavor",,,0.8,,,,
3940,"Ice creams, chocolate, light",,,0.8,,,,
3941,"Puddings, chocolate, dry mix, regular, prepared with whole milk",,,0.8,,,,
3942,"Puddings, chocolate, dry mix, regular, prepared with 2% milk",,,0.8,,,,
3943,"Ice creams, BREYERS, No Sugar Added, Vanilla Fudge Twirl",,,0.8,,,,
3944,"Fast foods, fish sandwich, with tartar sauce and cheese",,,0.8,,,,
3945,"Fast foods, griddle cake sandwich, egg, cheese, and bacon",,,0.8,,,,
3946,"McDONALD'S, Bacon, Egg  &  Cheese McGRIDDLES",,,0.8,,,,
3947,"McDONALD'S, Double Cheeseburger",,,0.8,,,,
3948,"McDONALD'S, Sausage Biscuit with Egg",,,0.8,,,,
3949,"POPEYES, Mild Chicken Strips, analyzed 2006",,,0.8,,,,
3950,"Beef Pot Pie, frozen entree, prepared",,,0.8,,,,
3951,"Soup, clam chowder, new england, reduced sodium, canned, ready-to-serve",,,0.8,,,,
3952,"Soup, chicken noodle, reduced sodium, canned, ready-to-serve",,,0.8,,,,
3953,"Soup, beef and vegetables, reduced sodium, canned, ready-to-serve",,,0.8,,,,
3954,"Turnover, meat- and cheese-filled, tomato-based sauce, reduced fat, frozen",,,0.8,,,,
3955,"Turnover, filled with egg, meat and cheese, frozen",,,0.8,,,,
3956,"Rice mix, white and wild, flavored, unprepared",,,0.8,,,,
3957,"T.G.I. FRIDAY'S, chicken fingers",,,0.8,,,,
3958,"DENNY'S, chicken nuggets, star shaped, from kid's menu",,,0.8,,,,
3959,"Restaurant, Chinese, orange chicken",,,0.8,,,,
3960,"Frozen novelties, ice cream type, vanilla ice cream, light, no sugar added, chocolate coated",,,0.8,,,,
3961,"Babyfood, dessert, banana pudding, strained",,,0.8,,,,
3962,"Tomato and vegetable juice, low sodium",,,0.8,,,,
3963,"Jellies, reduced sugar, home preserved",,,0.8,,,,
3964,"Puddings, all flavors except chocolate, low calorie, instant, dry mix",,,0.8,,,,
3965,"Milk, chocolate, fluid, commercial, reduced fat, with added vitamin A and vitamin D",,,0.7,,,,
3966,"Milk, chocolate, fluid, commercial, reduced fat, with added calcium",,,0.7,,,,
3967,"Ice cream, soft serve, chocolate",,,0.7,,,,
3968,"Babyfood, dinner, macaroni and cheese, strained",,,0.7,,,,
3969,"Babyfood, dessert, peach cobbler, strained",,,0.7,,,,
3970,"Babyfood, dessert, peach cobbler, junior",,,0.7,,,,
3971,"Babyfood, dessert, fruit pudding, pineapple, strained",,,0.7,,,,
3972,"Infant formula, ABBOTT NUTRITION, SIMILAC, Expert Care, Diarrhea, ready- to- feed with ARA and DHA",,,0.7,,,,
3973,"Salad dressing, russian dressing",,,0.7,,,,
3974,"Soup, chicken vegetable, canned, condensed",,,0.7,,,,
3975,"Soup, clam chowder, new england, canned, condensed",,,0.7,,,,
3976,"Soup, cream of mushroom, canned, condensed",,,0.7,,,,
3977,"Soup, onion, canned, condensed",,,0.7,,,,
3978,"Sauce, plum, ready-to-serve",,,0.7,,,,
3979,"Soup, tomato rice, canned, prepared with equal volume water",,,0.7,,,,
3980,"Soup, vegetable with beef broth, canned, prepared with equal volume water",,,0.7,,,,
3981,"Sauce, peppers, hot, chili, mature red, canned",,,0.7,,,,
3982,"Gravy, HEINZ Home Style, savory beef",,,0.7,,,,
3983,"Cereals ready-to-eat, RALSTON CRISP RICE",,,0.7,,,,
3984,"Cereals, CREAM OF RICE, dry",,,0.7,,,,
3985,"Cereals, corn grits, yellow, regular and quick, enriched, cooked with water, without salt",,,0.7,,,,
3986,"Cereals, corn grits, yellow, regular, quick, enriched, cooked with water, with salt",,,0.7,,,,
3987,"Cereals, CREAM OF WHEAT, 2 1/2 minute cook time, cooked with water, stove-top, without salt",,,0.7,,,,
3988,"Cereals, CREAM OF WHEAT, 2 1/2 minute cook time, cooked with water, microwaved, without salt",,,0.7,,,,
3989,"Lemon juice from concentrate, canned or bottled",,,0.7,,,,
3990,"Melon balls, frozen",,,0.7,,,,
3991,"Tangerines, (mandarin oranges), canned, juice pack",,,0.7,,,,
3992,"Tangerines, (mandarin oranges), canned, light syrup pack",,,0.7,,,,
3993,"Pineapple juice, frozen concentrate, unsweetened, undiluted",,,0.7,,,,
3994,"Fruit juice smoothie, NAKED JUICE, GREEN MACHINE",,,0.7,,,,
3995,"Lemon juice from concentrate, bottled, REAL LEMON",,,0.7,,,,
3996,"Cress, garden, cooked, boiled, drained, without salt",,,0.7,,,,
3997,"Cucumber, peeled, raw",,,0.7,,,,
3998,"Tomatoes, red, ripe, cooked",,,0.7,,,,
3999,Spinach souffle,,,0.7,,,,
4000,"Tomatoes, yellow, raw",,,0.7,,,,
4001,"Cress, garden, cooked, boiled, drained, with salt",,,0.7,,,,
4002,"Tomatoes, red, ripe, cooked, with salt",,,0.7,,,,
4003,"Corn, sweet, white, canned, whole kernel, no salt added, solids and liquids",,,0.7,,,,
4004,"Beverages, OCEAN SPRAY, Light Cranberry and Raspberry Flavored Juice",,,0.7,,,,
4005,"Beverages, OCEAN SPRAY, Light Cranberry",,,0.7,,,,
4006,"Beverages, OCEAN SPRAY, Light Cranberry, Concord Grape",,,0.7,,,,
4007,"Beverages, tea, instant, lemon, sweetened, powder",,,0.7,,,,
4008,"Fish, catfish, channel, cooked, breaded and fried",,,0.7,,,,
4009,"Soymilk, chocolate and other flavors, light, with added calcium, vitamins A and D",,,0.7,,,,
4010,"Soy sauce made from soy and wheat (shoyu), low sodium",,,0.7,,,,
4011,"Biscuits, plain or buttermilk, refrigerated dough, higher fat",,,0.7,,,,
4012,"Cake, pudding-type, white, enriched, dry mix",,,0.7,,,,
4013,"Cake, pudding-type, yellow, dry mix",,,0.7,,,,
4014,"Cake, yellow, prepared from recipe without frosting",,,0.7,,,,
4015,"Pie, banana cream, prepared from recipe",,,0.7,,,,
4016,"Cake, pudding-type, white, unenriched, dry mix",,,0.7,,,,
4017,"Archway Home Style Cookies, Frosty Lemon",,,0.7,,,,
4018,"Bread, salvadoran sweet cheese (quesadilla salvadorena)",,,0.7,,,,
4019,"Ice creams, french vanilla, soft-serve",,,0.7,,,,
4020,"Ice creams, vanilla",,,0.7,,,,
4021,"Candies, fudge, peanut butter, prepared-from-recipe",,,0.7,,,,
4022,"Toppings, strawberry",,,0.7,,,,
4023,"Puddings, rice, dry mix",,,0.7,,,,
4024,"Candies, MARS SNACKFOOD US, MILKY WAY Caramels, milk chocolate covered",,,0.7,,,,
4025,"Marmalade, orange",,,0.7,,,,
4026,"Frozen novelties, ice type, pineapple-coconut",,,0.7,,,,
4027,"Ice creams, BREYERS, No Sugar Added, Vanilla Chocolate Strawberry",,,0.7,,,,
4028,"Fast foods, biscuit, with ham",,,0.7,,,,
4029,"Fast foods, shrimp, breaded and fried",,,0.7,,,,
4030,"Fast foods, submarine sandwich, roast beef on white bread with lettuce and tomato",,,0.7,,,,
4031,"Fast foods, submarine sandwich, tuna on white bread with lettuce and tomato",,,0.7,,,,
4032,"SUBWAY, roast beef sub on white bread with lettuce and tomato",,,0.7,,,,
4033,"SUBWAY, tuna sub on white bread with lettuce and tomato",,,0.7,,,,
4034,"BURGER KING, CROISSAN'WICH with Sausage and Cheese",,,0.7,,,,
4035,"BURGER KING, CROISSAN'WICH with Egg and Cheese",,,0.7,,,,
4036,"Rice bowl with chicken, frozen entree, prepared (includes fried, teriyaki, and sweet and sour varieties)",,,0.7,,,,
4037,"Chicken, nuggets, white meat, precooked, frozen, not reheated",,,0.7,,,,
4038,"Rice and vermicelli mix, chicken flavor, prepared with 80% margarine",,,0.7,,,,
4039,"Dip, salsa con queso, cheese and salsa- medium",,,0.7,,,,
4040,"CRACKER BARREL, chicken tenderloin platter, fried",,,0.7,,,,
4041,"CRACKER BARREL, macaroni n' cheese plate, from kid's menu",,,0.7,,,,
4042,"Restaurant, Chinese, sesame chicken",,,0.7,,,,
4043,"Syrups, sugar free",,,0.7,,,,
4044,"Yogurt, Greek, strawberry, nonfat",,,0.6,,,,
4045,"Babyfood, dinner, chicken stew, toddler",,,0.6,,,,
4046,"Babyfood, dessert, fruit pudding, orange, strained",,,0.6,,,,
4047,"Babyfood, dessert, fruit dessert, without ascorbic acid, strained",,,0.6,,,,
4048,"Babyfood, dessert, fruit dessert, without ascorbic acid, junior",,,0.6,,,,
4049,"Babyfood, cereal, barley, prepared with whole milk",,,0.6,,,,
4050,"Babyfood, yogurt, whole milk, with fruit, multigrain cereal and added iron fortified",,,0.6,,,,
4051,"Salad dressing, italian dressing, fat-free",,,0.6,,,,
4052,"Chicken, wing, frozen, glazed, barbecue flavored",,,0.6,,,,
4053,"Soup, beef noodle, canned, condensed",,,0.6,,,,
4054,"Soup, cream of celery, canned, condensed",,,0.6,,,,
4055,"Soup, chicken, canned, chunky, ready-to-serve",,,0.6,,,,
4056,"Soup, chunky beef, canned, ready-to-serve",,,0.6,,,,
4057,"Sauce, ready-to-serve, pepper, TABASCO",,,0.6,,,,
4058,"Soup, cream of mushroom, canned, condensed, reduced sodium",,,0.6,,,,
4059,"CAMPBELL'S, Cream of Mushroom Soup, condensed",,,0.6,,,,
4060,"Soup, clam chowder, manhattan, canned, prepared with equal volume water",,,0.6,,,,
4061,"Soup, tomato beef with noodle, canned, prepared with equal volume water",,,0.6,,,,
4062,"Soup, tomato, low sodium, with water",,,0.6,,,,
4063,"Soup, beef stroganoff, canned, chunky style, ready-to-serve",,,0.6,,,,
4064,"Sausage, turkey, pork, and beef, low fat, smoked",,,0.6,,,,
4065,"Cereals, CREAM OF WHEAT, instant, prepared with water, without salt",,,0.6,,,,
4066,"Grapefruit juice, white, canned or bottled, unsweetened",,,0.6,,,,
4067,"Grapes, canned, thompson seedless, water pack, solids and liquids",,,0.6,,,,
4068,"Grapes, canned, thompson seedless, heavy syrup pack, solids and liquids",,,0.6,,,,
4069,"Papaya nectar, canned",,,0.6,,,,
4070,"Pear nectar, canned, without added ascorbic acid",,,0.6,,,,
4071,"Pear nectar, canned, with added ascorbic acid",,,0.6,,,,
4072,"Grapefruit juice, white, bottled, unsweetened, OCEAN SPRAY",,,0.6,,,,
4073,"Fruit juice smoothie, ODWALLA, ORIGINAL SUPERFOOD",,,0.6,,,,
4074,"Fruit juice smoothie, BOLTHOUSE FARMS, GREEN GOODNESS",,,0.6,,,,
4075,"Fruit juice smoothie, BOLTHOUSE FARMS, strawberry banana",,,0.6,,,,
4076,"Fruit juice smoothie, ODWALLA, strawberry banana",,,0.6,,,,
4077,"Fruit juice smoothie, NAKED JUICE, strawberry banana",,,0.6,,,,
4078,"Mushrooms, brown, italian, or crimini, raw",,,0.6,,,,
4079,"Mushrooms, brown, italian, or crimini, exposed to ultraviolet light, raw",,,0.6,,,,
4080,"Beverages, OCEAN SPRAY, Cran Grape",,,0.6,,,,
4081,"Beverages, OCEAN SPRAY, Cranberry-Apple Juice Drink, bottled",,,0.6,,,,
4082,"Beverages, OCEAN SPRAY, Diet Cranberry Juice",,,0.6,,,,
4083,"Beverages, OCEAN SPRAY, White Cranberry Strawberry Flavored Juice Drink",,,0.6,,,,
4084,"Beverages, OCEAN SPRAY, Cran Raspberry Juice Drink",,,0.6,,,,
4085,"Beverages, OCEAN SPRAY, Cran Lemonade",,,0.6,,,,
4086,"Beverages, OCEAN SPRAY, Diet Cran Cherry",,,0.6,,,,
4087,"Beverages, OCEAN SPRAY, Cran Pomegranate",,,0.6,,,,
4088,"Beverages, OCEAN SPRAY, Cran Cherry",,,0.6,,,,
4089,"Beverages, OCEAN SPRAY, White Cranberry Peach",,,0.6,,,,
4090,"Beverages, OCEAN SPRAY, Ruby Red cranberry",,,0.6,,,,
4091,"Beverages, cocoa mix, with aspartame, powder, prepared with water",,,0.6,,,,
4092,"Soymilk, original and vanilla, unfortified",,,0.6,,,,
4093,"Tofu, hard, prepared with nigari",,,0.6,,,,
4094,"Vitasoy USA, Nasoya Lite Firm Tofu",,,0.6,,,,
4095,"Soymilk, original and vanilla, light, unsweetened, with added calcium, vitamins A and D",,,0.6,,,,
4096,SILK Vanilla soy yogurt (single serving size),,,0.6,,,,
4097,SILK Strawberry soy yogurt,,,0.6,,,,
4098,SILK Raspberry soy yogurt,,,0.6,,,,
4099,SILK Peach soy yogurt,,,0.6,,,,
4100,SILK Black Cherry soy yogurt,,,0.6,,,,
4101,SILK Blueberry soy yogurt,,,0.6,,,,
4102,SILK Key Lime soy yogurt,,,0.6,,,,
4103,SILK Banana-Strawberry soy yogurt,,,0.6,,,,
4104,"Vitasoy USA Organic Nasoya, Soft Tofu",,,0.6,,,,
4105,"Vitasoy USA Azumaya, Firm Tofu",,,0.6,,,,
4106,"Cake, pound, commercially prepared, butter (includes fresh and frozen)",,,0.6,,,,
4107,"Pie, banana cream, prepared from mix, no-bake type",,,0.6,,,,
4108,"Pie, vanilla cream, prepared from recipe",,,0.6,,,,
4109,"Candies, TWIZZLERS NIBS CHERRY BITS",,,0.6,,,,
4110,"Desserts, mousse, chocolate, prepared-from-recipe",,,0.6,,,,
4111,"Puddings, vanilla, dry mix, regular",,,0.6,,,,
4112,"Pie fillings, canned, cherry",,,0.6,,,,
4113,"Ice creams, BREYERS, All Natural Light Mint Chocolate Chip",,,0.6,,,,
4114,"Sweeteners, sugar substitute, granulated, brown",,,0.6,,,,
4115,"Rice, white, long-grain, precooked or instant, enriched, prepared",,,0.6,,,,
4116,"Fast foods, griddle cake sandwich, egg, cheese, and sausage",,,0.6,,,,
4117,"McDONALD'S, Sausage, Egg  &  Cheese McGRIDDLES",,,0.6,,,,
4118,"POPEYES, Fried Chicken, Mild, Wing, meat and skin with breading",,,0.6,,,,
4119,"Sauce, duck, ready-to-serve",,,0.6,,,,
4120,"Dip, TOSTITOS, salsa con queso, medium",,,0.6,,,,
4121,"Rice and vermicelli mix, beef flavor, prepared with 80% margarine",,,0.6,,,,
4122,"Rice and vermicelli mix, rice pilaf flavor, prepared with 80% margarine",,,0.6,,,,
4123,"Cheese, cottage, lowfat, 1% milkfat, lactose reduced",,,0.6,,,,
4124,"Babyfood, fruit, tutti frutti, strained",,,0.6,,,,
4125,"Beverages, Chocolate-flavored drink, whey and milk based",,,0.6,,,,
4126,"Frozen novelties, ice cream type, chocolate or caramel covered, with nuts",,,0.6,,,,
4127,"Yogurt, Greek, nonfat, vanilla, DANNON OIKOS",,,0.5,,,,
4128,"Yogurt, Greek, vanilla, nonfat",,,0.5,,,,
4129,"Babyfood, macaroni and cheese, toddler",,,0.5,,,,
4130,"Child formula, ABBOTT NUTRITION, PEDIASURE, ready-to-feed, with iron and fiber",,,0.5,,,,
4131,"Chicken, wing, frozen, glazed, barbecue flavored, heated (conventional oven)",,,0.5,,,,
4132,"Soup, vegetarian vegetable, canned, condensed",,,0.5,,,,
4133,"Soup, tomato, canned, prepared with equal volume low fat (2%) milk",,,0.5,,,,
4134,"Soup, chicken noodle, canned, prepared with equal volume water",,,0.5,,,,
4135,"Soup, tomato, canned, prepared with equal volume water, commercial",,,0.5,,,,
4136,"Sauce, cheese, ready-to-serve",,,0.5,,,,
4137,"Bologna, turkey",,,0.5,,,,
4138,"Turkey breast, low salt, prepackaged or deli, luncheon meat",,,0.5,,,,
4139,"Cereals, CREAM OF WHEAT, regular (10 minute), cooked with water, without salt",,,0.5,,,,
4140,"Cereals, CREAM OF WHEAT, regular (10 minute), cooked with water, with salt",,,0.5,,,,
4141,"Tamarind nectar, canned",,,0.5,,,,
4142,"Cucumber, with peel, raw",,,0.5,,,,
4143,"Gourd, white-flowered (calabash), raw",,,0.5,,,,
4144,"Pumpkin, raw",,,0.5,,,,
4145,"Seaweed, agar, raw",,,0.5,,,,
4146,"Vegetable juice cocktail, canned",,,0.5,,,,
4147,"Vegetable juice cocktail, low sodium, canned",,,0.5,,,,
4148,"Watercress, raw",,,0.5,,,,
4149,"Seaweed, wakame, raw",,,0.5,,,,
4150,"Beverages, Cocoa mix, powder, prepared with water",,,0.5,,,,
4151,"Beverages, coffee, instant, with chicory",,,0.5,,,,
4152,"Beverages, Malted drink mix, chocolate, powder, prepared with whole milk",,,0.5,,,,
4153,"Crustaceans, crab, alaska king, imitation, made from surimi",,,0.5,,,,
4154,"Noodles, chinese, cellophane or long rice (mung beans), dehydrated",,,0.5,,,,
4155,Soy sauce made from hydrolyzed vegetable protein,,,0.5,,,,
4156,"Soymilk (all flavors), unsweetened, with added calcium, vitamins A and D",,,0.5,,,,
4157,"Cake, cherry fudge with chocolate frosting",,,0.5,,,,
4158,"Cake, sponge, commercially prepared",,,0.5,,,,
4159,"Pie, coconut cream, prepared from mix, no-bake type",,,0.5,,,,
4160,"Ice creams, BREYERS, No Sugar Added, French Vanilla",,,0.5,,,,
4161,"Ice creams, BREYERS, No Sugar Added, Vanilla",,,0.5,,,,
4162,"Fast foods, biscuit, with egg and bacon",,,0.5,,,,
4163,"Fast foods, english muffin, with cheese and sausage",,,0.5,,,,
4164,"POPEYES, Fried Chicken, Mild, Thigh, meat and skin with breading",,,0.5,,,,
4165,"Fast Foods, Fried Chicken, Drumstick, meat and skin with breading",,,0.5,,,,
4166,"Macaroni and Cheese, canned entree",,,0.5,,,,
4167,"Chili, no beans, canned entree",,,0.5,,,,
4168,"Soup, hot and sour, Chinese restaurant",,,0.5,,,,
4169,"Sauce, tartar, ready-to-serve",,,0.5,,,,
4170,"Sauce, barbecue, OPEN PIT, original",,,0.5,,,,
4171,"Sauce, enchilada, red, mild, ready to serve",,,0.5,,,,
4172,"Cookies, gluten-free, vanilla sandwich, with creme filling",,,0.5,,,,
4173,"Babyfood, rice cereal, dry, EARTHS BEST ORGANIC WHOLE GRAIN, fortified only with iron",,,0.5,,,,
4174,"Restaurant, Latino, arroz con leche (rice pudding)",,,0.5,,,,
4175,"Babyfood, apple yogurt dessert, strained",,,0.5,,,,
4176,"Babyfood, juice, apple-sweet potato",,,0.5,,,,
4177,"Salad dressing, caesar dressing, regular",,,0.5,,,,
4178,"Beverages, coffee, instant, with whitener, reduced calorie",,,0.5,,,,
4179,"Babyfood, dessert, banana yogurt, strained",,,0.5,,,,
4180,Reddi Wip Fat Free Whipped Topping,,,0.4,,,,
4181,"Yogurt, Greek, nonfat, strawberry, DANNON OIKOS",,,0.4,,,,
4182,"Babyfood, juice, fruit punch, with calcium",,,0.4,,,,
4183,"Babyfood, juice, apple, with calcium",,,0.4,,,,
4184,"Babyfood, cereal, mixed, with bananas, prepared with whole milk",,,0.4,,,,
4185,"Babyfood, cereal, oatmeal, with bananas, prepared with whole milk",,,0.4,,,,
4186,"Infant formula, MEAD JOHNSON, ENFAMIL, AR, ready-to-feed, with ARA and DHA",,,0.4,,,,
4187,"Sandwich spread, with chopped pickle, regular, unspecified oils",,,0.4,,,,
4188,"Salad dressing, blue or roquefort cheese dressing, commercial, regular",,,0.4,,,,
4189,"Salad dressing, honey mustard, regular",,,0.4,,,,
4190,"Soup, cream of asparagus, canned, condensed",,,0.4,,,,
4191,"Soup, chicken rice, canned, chunky, ready-to-serve",,,0.4,,,,
4192,"Soup, cream of onion, canned, condensed",,,0.4,,,,
4193,"Gravy, beef, canned, ready-to-serve",,,0.4,,,,
4194,"Gravy, mushroom, canned",,,0.4,,,,
4195,"Gravy, turkey, canned, ready-to-serve",,,0.4,,,,
4196,"Soup, cheese, canned, prepared with equal volume milk",,,0.4,,,,
4197,"Sauce, barbecue, KRAFT, original",,,0.4,,,,
4198,"Soup, cheese, canned, prepared with equal volume water",,,0.4,,,,
4199,"Soup, minestrone, canned, prepared with equal volume water",,,0.4,,,,
4200,"Soup, cream of onion, canned, prepared with equal volume water",,,0.4,,,,
4201,"Soup, tomato, dry, mix, prepared with water",,,0.4,,,,
4202,"Soup, cream of chicken, canned, condensed, reduced sodium",,,0.4,,,,
4203,"Soup, vegetable chicken, canned, prepared with water, low sodium",,,0.4,,,,
4204,"Turkey, white, rotisserie, deli cut",,,0.4,,,,
4205,"Cereals ready-to-eat, MALT-O-MEAL, Crispy Rice",,,0.4,,,,
4206,Milk and cereal bar,,,0.4,,,,
4207,"Cereals, MALT-O-MEAL, chocolate, prepared with water, without salt",,,0.4,,,,
4208,"Cereals, CREAM OF WHEAT, 1 minute cook time, cooked with water, stove-top, without salt",,,0.4,,,,
4209,"Apple juice, frozen concentrate, unsweetened, undiluted, without added ascorbic acid",,,0.4,,,,
4210,"Grapefruit, sections, canned, water pack, solids and liquids",,,0.4,,,,
4211,"Grapefruit, sections, canned, juice pack, solids and liquids",,,0.4,,,,
4212,"Grapefruit, sections, canned, light syrup pack, solids and liquids",,,0.4,,,,
4213,"Grapefruit juice, white, frozen concentrate, unsweetened, undiluted",,,0.4,,,,
4214,"Lime juice, raw",,,0.4,,,,
4215,"Lime juice, canned or bottled, unsweetened",,,0.4,,,,
4216,"Watermelon, raw",,,0.4,,,,
4217,Poi,,,0.4,,,,
4218,"Tomato juice, canned, with salt added",,,0.4,,,,
4219,"Tomato juice, canned, without salt added",,,0.4,,,,
4220,"Beverages, almond milk, sweetened, vanilla flavor, ready-to-drink",,,0.4,,,,
4221,"Beverages, SLIMFAST, Meal replacement,  High Protein Shake, Ready-To-Drink, 3-2-1 plan",,,0.4,,,,
4222,"Beverages, almond milk, chocolate, ready-to-drink",,,0.4,,,,
4223,"Beverages, V8 SPLASH Smoothies, Tropical Colada",,,0.4,,,,
4224,"Beverages, chocolate almond milk, unsweetened, shelf-stable, fortified with vitamin D2 and E",,,0.4,,,,
4225,"Beverages, Carob-flavor beverage mix, powder, prepared with whole milk",,,0.4,,,,
4226,"Beverages, chocolate-flavor beverage mix, powder, prepared with whole milk",,,0.4,,,,
4227,"Beverages, Clam and tomato juice, canned",,,0.4,,,,
4228,"Beverages, coffee substitute, cereal grain beverage, prepared with water",,,0.4,,,,
4229,"Beverages, Fruit punch drink, frozen concentrate",,,0.4,,,,
4230,"Beverages, Lemonade, powder",,,0.4,,,,
4231,"Beverages, Malted drink mix, chocolate, with added nutrients, powder, prepared with whole milk",,,0.4,,,,
4232,"Beverages, orange-flavor drink, breakfast type, powder",,,0.4,,,,
4233,"Beverages, shake, fast food, strawberry",,,0.4,,,,
4234,"Beverages, chocolate-flavor beverage mix for milk, powder, with added nutrients, prepared with whole milk",,,0.4,,,,
4235,"Beverages, milk beverage, reduced fat, flavored and sweetened, Ready-to-drink,  added calcium, vitamin A and vitamin D",,,0.4,,,,
4236,"Fish, croaker, Atlantic, cooked, breaded and fried",,,0.4,,,,
4237,"Crustaceans, shrimp, mixed species, cooked, breaded and fried",,,0.4,,,,
4238,"Soymilk, chocolate, unfortified",,,0.4,,,,
4239,"Soymilk, chocolate, with added calcium, vitamins A and D",,,0.4,,,,
4240,"Vitasoy USA, Vitasoy Organic Creamy Original Soymilk",,,0.4,,,,
4241,"Vitasoy USA, Vitasoy Organic Classic Original Soymilk",,,0.4,,,,
4242,"Soymilk (All flavors), enhanced",,,0.4,,,,
4243,"SILK Plain, soymilk",,,0.4,,,,
4244,"SILK Vanilla, soymilk",,,0.4,,,,
4245,"SILK Light Plain, soymilk",,,0.4,,,,
4246,"SILK Light Vanilla, soymilk",,,0.4,,,,
4247,"SILK Plus Omega-3 DHA, soymilk",,,0.4,,,,
4248,"SILK Unsweetened, soymilk",,,0.4,,,,
4249,"SILK Very Vanilla, soymilk",,,0.4,,,,
4250,SILK Vanilla soy yogurt (family size),,,0.4,,,,
4251,SILK Plain soy yogurt,,,0.4,,,,
4252,"Cake, cheesecake, commercially prepared",,,0.4,,,,
4253,"Puddings, chocolate, dry mix, instant, prepared with 2% milk",,,0.4,,,,
4254,"Toppings, pineapple",,,0.4,,,,
4255,"Ice creams, BREYERS, All Natural Light Vanilla Chocolate Strawberry",,,0.4,,,,
4256,"Rice, white, long-grain, regular, enriched, cooked",,,0.4,,,,
