5584,"Popcorn, sugar syrup/caramel, fat-free",1.0 oz,,,,25.53,,
5585,"Cookies, sugar wafers with creme filling, regular",3.0 cookies,,,,25.43,,
5586,"Mission Foods, Mission Flour Tortillas, Soft Taco, 8 inch",1.0 serving,,,,25.3,,
5587,"Cereals ready-to-eat, QUAKER, Maple Brown Sugar LIFE Cereal",0.75 cups (1 NLEA serving),,,,25.24,,
5588,"Grapes, canned, thompson seedless, water pack, solids and liquids",1.0 cups,,,,25.23,,
5589,"Beverages, Whey protein powder isolate",3.0 scoop,,,,25.0,,
5590,"Beverages, The COCA-COLA company, Hi-C Flashin' Fruit Punch",6.0 fl oz,,,,25.0,,
5591,"Cereals ready-to-eat, QUAKER, QUAKER OAT LIFE, plain",0.75 cups (1 NLEA serving),,,,24.88,,
5592,"Cereals ready-to-eat, POST, COCOA PEBBLES",0.75 cups (1 NLEA serving),,,,24.85,,
5593,"Cereals ready-to-eat, POST HONEY BUNCHES OF OATS with cinnamon bunches",0.75 cups (1 NLEA serving),,,,24.84,,
5594,"Mangos, raw",1.0 cups pieces,,,,24.72,,
5595,"POPEYES, biscuit",1.0 biscuit,,,,24.57,,
5596,"Grapefruit, raw, pink and red, all areas","1.0 cups sections, with juice",,,,24.52,,
5597,"Martha White Foods, Martha White's Buttermilk Biscuit Mix, dry",1.0 serving,,,,24.36,,
5598,"Tomato products, canned, sauce, with onions",1.0 cups,,,,24.35,,
5599,"Tortillas, ready-to-bake or -fry, flour, shelf stable",1.0 tortilla,,,,24.14,,
5600,"Squash, winter, butternut, frozen, cooked, boiled, without salt","1.0 cups, mashed",,,,24.12,,
5601,"Pillsbury, Crusty French Loaf, refrigerated dough",1.0 serving,,,,24.1,,
5602,"Crackers, wheat, regular",16.0 crackers 1 serving,,,,24.05,,
5603,"Artificial Blueberry Muffin Mix, dry",1.0 muffin,,,,24.01,,
5604,"Candies, dark chocolate coated coffee beans",1.0 serving 28 pieces,,,,23.98,,
5605,"Puddings, tapioca, ready-to-eat, fat free",1.0 container refrigerated 4 oz,,,,23.87,,
5606,"Frostings, glaze, chocolate, prepared-from-recipe, with butter, NFSMI Recipe No. C-32",2.0 tablespoon,,,,23.82,,
5607,"Candies, MARS SNACKFOOD US, POP'ABLES SNICKERS Brand Bite Size Candies",1.0 serving 13 pieces,,,,23.82,,
5608,"Heinz, Weight Watcher, Chocolate Eclair, frozen","1.0 eclair, frozen",,,,23.78,,
5609,"Snacks, potato chips, fat free, salted",1.0 oz,,,,23.75,,
5610,"Blackberries, frozen, unsweetened","1.0 cups, unthawed",,,,23.66,,
5611,"Sweet potato, cooked, baked in skin, flesh, with salt","1.0 medium (2"" dia, 5"" long, raw)",,,,23.61,,
5612,"Puddings, chocolate, ready-to-eat, fat free",1.0 serving 4 oz,,,,23.58,,
5613,"Pillsbury, Cinnamon Rolls with Icing, refrigerated dough",1.0 serving 1 roll with icing,,,,23.5,,
5614,"Peanuts, valencia, oil-roasted, without salt",1.0 cups,,,,23.47,,
5615,"Martha White Foods, Martha White's Chewy Fudge Brownie Mix, dry",1.0 serving,,,,23.4,,
5616,"Beverages, Meal supplement drink, canned, peanut flavor",1.0 cups,,,,23.29,,
5617,"Pillsbury, Chocolate Chip Cookies, refrigerated dough",1.0 serving 2 cookies,,,,23.09,,
5618,Chocolate-flavored hazelnut spread,1.0 serving 2 TBSP,,,,23.07,,
5619,"Snacks, pretzels, hard, whole-wheat including both salted and unsalted",1.0 oz,,,,23.05,,
5620,"Soup, bean with bacon, condensed, single brand",1.0 serving 1/2 cups,,,,23.04,,
5621,"Candies, HERSHEY'S, ALMOND JOY BITES",18.0 pieces,,,,23.02,,
5622,"Cookies, chocolate chip, commercially prepared, regular, lower fat",1.0 serving 3 cookies,,,,22.95,,
5623,"Cracker, meal",1.0 oz,,,,22.94,,
5624,"Grapefruit, sections, canned, juice pack, solids and liquids",1.0 cups,,,,22.93,,
5625,"Crackers, cheese, sandwich-type with cheese filling",6.0 cracker 1 cracker = 6.5g,,,,22.92,,
5626,"Beverages, UNILEVER, SLIMFAST, meal replacement, regular, ready-to-drink,  3-2-1 Plan",1.0 bottle,,,,22.83,,
5627,"Potatoes, mashed, dehydrated, prepared from flakes without milk, whole milk and butter added",1.0 cups,,,,22.83,,
5628,"Cookies, brownies, dry mix, sugar free",1.0 oz,,,,22.79,,
5629,"Cereals ready-to-eat, BARBARA'S PUFFINS, original",0.75 cups (1 NLEA serving),,,,22.68,,
5630,"Cereals ready-to-eat, QUAKER, QUAKER CRUNCHY BRAN",0.75 cups (1 NLEA serving),,,,22.59,,
5631,"Dessert topping, powdered",1.0 oz,,,,22.59,,
5632,"Cereals ready-to-eat, NATURE'S PATH, Organic FLAX PLUS flakes",0.75 cups (1 NLEA serving),,,,22.58,,
5633,"Cake, white, dry mix, special dietary (includes lemon-flavored)",1.0 oz,,,,22.57,,
5634,"Beverages, almond milk, chocolate, ready-to-drink",8.0 fl oz,,,,22.51,,
5635,"Tomato products, canned, puree, with salt added",1.0 cups,,,,22.45,,
5636,"Tomato products, canned, puree, without salt added",1.0 cups,,,,22.45,,
5637,"Keikitos (muffins), Latino bakery item",1.0 piece,,,,22.33,,
5638,"Grapefruit, sections, canned, water pack, solids and liquids",1.0 cups,,,,22.33,,
5639,"Keebler, Keebler Chocolate Graham SELECTS",1.0 serving,,,,22.26,,
5640,"Frozen novelties, KLONDIKE, SLIM-A-BEAR Fudge Bar, 98% fat free, no sugar added",1.0 serving 3.5 fl oz bar,,,,22.25,,
5641,"Potatoes, roasted, salt added in processing, frozen, unprepared",3.0 oz,,,,22.23,,
5642,"Squash, winter, hubbard, baked, with salt","1.0 cups, cubes",,,,22.16,,
5643,"Cherries, sweet, raw","1.0 cups, with pits, yields",,,,22.09,,
5644,"Tomato products, canned, sauce, with onions, green peppers, and celery",1.0 cups,,,,21.93,,
5645,"Papaya, canned, heavy syrup, drained",1.0 piece,,,,21.77,,
5646,"Bread, stuffing, cornbread, dry mix",1.0 oz,,,,21.74,,
5647,"Bread, stuffing, dry mix",1.0 oz,,,,21.6,,
5648,"Squash, winter, acorn, cooked, boiled, mashed, without salt","1.0 cups, mashed",,,,21.54,,
5649,"Squash, winter, acorn, cooked, boiled, mashed, with salt","1.0 cups, mashed",,,,21.54,,
5650,"Bread, cheese",1.0 slice,,,,21.52,,
5651,"Squash, winter, butternut, cooked, baked, without salt","1.0 cups, cubes",,,,21.5,,
5652,"Oranges, raw, California, valencias","1.0 cups sections, without membranes",,,,21.4,,
5653,"Nabisco, Nabisco Grahams Crackers",1.0 serving,,,,21.34,,
5654,"Pears, raw","1.0 cups, slices",,,,21.32,,
5655,"Apples, frozen, unsweetened, unheated (Includes foods for USDA's Food Distribution Program)",1.0 cups slices,,,,21.3,,
5656,"Peas, green, raw",1.0 cups,,,,20.95,,
5657,"Cookies, molasses",1.0 oz,,,,20.92,,
5658,"Milk, canned, condensed, sweetened",1.0 fl oz,,,,20.78,,
5659,"Puddings, rice, ready-to-eat",1.0 serving 4 oz pudding cups,,,,20.78,,
5660,"Seeds, lotus seeds, dried",1.0 cups,,,,20.63,,
5661,"Cookies, chocolate wafers",1.0 oz,,,,20.61,,
5662,Eggnog,1.0 cups,,,,20.45,,
5663,"Carissa, (natal-plum), raw",1.0 cups slices,,,,20.45,,
5664,"Cookies, vanilla sandwich with creme filling",1.0 oz,,,,20.44,,
5665,"Snacks, crisped rice bar, chocolate chip",1.0 bar (1 oz),,,,20.44,,
5666,"Focaccia, Italian flatbread, plain",1.0 piece,,,,20.42,,
5667,"Lime juice, raw",1.0 cups,,,,20.38,,
5668,"Snacks, tortilla chips, nacho-flavor, reduced fat",1.0 oz,,,,20.3,,
5669,"Pancakes, buckwheat, dry mix, incomplete",1.0 oz,,,,20.21,,
5670,"Ice creams, BREYERS, All Natural Light French Chocolate",1.0 serving 1/2 cups,,,,20.18,,
5671,"Cookies, chocolate chip, refrigerated dough",1.0 serving,,,,20.14,,
5672,"Cookies, fig bars",1.0 oz,,,,20.1,,
5673,"Frostings, coconut-nut, ready-to-eat",0.08 package,,,,20.03,,
5674,"Crackers, cream, Gamesa Sabrosas",11.0 crackers (1 NLEA serving),,,,20.01,,
5675,"Beverages, V8 SPLASH Juice Drinks, Mango Peach",1.0 serving 8 oz,,,,20.0,,
5676,"Beverages, V8 SPLASH Smoothies, Strawberry Banana",1.0 serving 8 oz,,,,19.99,,
5677,"Soybeans, green, cooked, boiled, drained, without salt",1.0 cups,,,,19.89,,
5678,"Cookies, oatmeal, commercially prepared, special dietary",1.0 oz,,,,19.82,,
5679,"Cookies, oatmeal, with raisins",1.0 oz,,,,19.55,,
5680,"Corn, sweet, yellow, canned, drained solids, rinsed with tap water","1.0 cups drained, rinsed",,,,19.53,,
5681,"Blackberry juice, canned",1.0 cups,,,,19.5,,
5682,"Cookies, oatmeal, commercially prepared, regular",1.0 oz,,,,19.48,,
5683,"Frozen novelties, No Sugar Added, FUDGSICLE pops",1.0 serving,,,,19.41,,
5684,"Archway Home Style Cookies, Iced Molasses",1.0 serving,,,,19.35,,
5685,"Cookies, chocolate sandwich, with extra creme filling",1.0 oz,,,,19.33,,
5686,"Candies, fudge, chocolate, with nuts, prepared-from-recipe",1.0 oz,,,,19.32,,
5687,"Ice creams, BREYERS, All Natural Light Mint Chocolate Chip",1.0 serving 1/2 cups,,,,19.31,,
5688,"Fruit salad, (peach and pear and apricot and pineapple and cherry), canned, water pack, solids and liquids",1.0 cups,,,,19.28,,
5689,"Cookies, chocolate sandwich, with creme filling, special dietary",1.0 oz,,,,19.28,,
5690,"Nuts, hazelnuts or filberts","1.0 cups, chopped",,,,19.2,,
5691,"Loganberries, frozen","1.0 cups, unthawed",,,,19.14,,
5692,"Cookies, sugar, commercially prepared, regular (includes vanilla)",1.0 oz,,,,19.09,,
5693,"Beverages, V8 SPLASH Smoothies, Peach Mango",1.0 serving 8 oz,,,,19.01,,
5694,"Grapefruit, raw, white, Florida","1.0 cups sections, with juice",,,,18.84,,
5695,"Cookies, sugar wafer, with creme filling, sugar free",1.0 oz,,,,18.78,,
5696,"Archway Home Style Cookies, Iced Oatmeal",1.0 serving,,,,18.69,,
5697,"Cookies, oatmeal, refrigerated dough, baked",1.0 oz,,,,18.63,,
5698,"Cookies, peanut butter sandwich, regular",1.0 oz,,,,18.6,,
5699,"Snacks, tortilla chips, low fat, made with olestra, nacho cheese",1.0 oz,,,,18.49,,
5700,"Snacks, corn-based, extruded, onion-flavor",1.0 oz,,,,18.46,,
5701,"Snacks, potato chips, fat-free, made with olestra",1.0 oz,,,,18.43,,
5702,"Cake, snack cakes, creme-filled, sponge",1.0 oz,,,,18.15,,
5703,"Cookies, shortbread, commercially prepared, plain",1.0 oz,,,,18.08,,
5704,"Archway Home Style Cookies, Molasses",1.0 serving,,,,18.05,,
5705,"Snacks, granola bars, soft, uncoated, peanut butter",1.0 bar (1 oz),,,,18.03,,
5706,"Snacks, fruit leather, rolls",1.0 large,,,,18.02,,
5707,"Garlic bread, frozen",1.0 slice presliced,,,,17.94,,
5708,"Snacks, tortilla chips, ranch-flavor",1.0 oz,,,,17.79,,
5709,"Snacks, KELLOGG, KELLOGG'S RICE KRISPIES TREATS Squares",1.0 serving,,,,17.71,,
5710,"Beets, canned, regular pack, solids and liquids",1.0 cups,,,,17.56,,
5711,"Bread, french or vienna, toasted (includes sourdough)",1.0 oz,,,,17.56,,
5712,"Seeds, pumpkin and squash seed kernels, roasted, with salt added",1.0 cups,,,,17.36,,
5713,"Tomato products, canned, sauce, with tomato tidbits",1.0 cups,,,,17.3,,
5714,"Cake, sponge, commercially prepared",1.0 oz,,,,17.29,,
5715,"Currants, european black, raw",1.0 cups,,,,17.23,,
5716,"Ice creams, BREYERS, All Natural Light Vanilla",1.0 serving 1/2 cups,,,,17.2,,
5717,"Cherries, sour, red, frozen, unsweetened (Includes foods for USDA's Food Distribution Program)","1.0 cups, unthawed",,,,17.08,,
5718,"Archway Home Style Cookies, Date Filled Oatmeal",1.0 serving,,,,17.04,,
5719,"Candies, chocolate, dark, NFS (45-59% cacao solids 90%; 60-69% cacao solids 5%; 70-85% cacao solids 5%)",1.0 oz,,,,17.0,,
5720,"POPEYES, Coleslaw",1.0 package,,,,16.94,,
5721,"Soup, chicken, canned, chunky, ready-to-serve",1.0 cups,,,,16.86,,
5722,"Lemon juice, raw",1.0 cups,,,,16.84,,
5723,"Cookies, oatmeal, refrigerated dough",1.0 oz,,,,16.75,,
5724,"Cookies, shortbread, commercially prepared, pecan",1.0 oz,,,,16.53,,
5725,"Cookies, peanut butter, commercially prepared, regular",1.0 oz,,,,16.49,,
5726,"Archway Home Style Cookies, Raspberry Filled",1.0 serving,,,,16.48,,
5727,"Cookies, peanut butter, commercially prepared, soft-type",1.0 oz,,,,16.36,,
5728,"Soup, tomato, canned, condensed, reduced sodium",1.0 serving 1/2 cups,,,,16.23,,
5729,"Cake, angelfood, commercially prepared",1.0 piece (1/12 of 12 oz cake),,,,16.18,,
5730,"Boysenberries, frozen, unsweetened","1.0 cups, unthawed",,,,16.09,,
5731,"Snacks, potato chips, made from dried potatoes, fat-free, made with olestra",1.0 oz,,,,15.88,,
5732,"Bread, irish soda, prepared from recipe",1.0 oz,,,,15.88,,
5733,"Snacks, potato chips, barbecue-flavor",1.0 oz,,,,15.85,,
5734,"Beverages, almond milk, sweetened, vanilla flavor, ready-to-drink",8.0 fl oz,,,,15.82,,
5735,"Tomatoes, red, ripe, canned, stewed",1.0 cups,,,,15.78,,
5736,"Grapes, american type (slip skin), raw",1.0 cups,,,,15.78,,
5737,"Papayas, raw","1.0 cups 1"" pieces",,,,15.69,,
5738,"Groundcherries, (cape-gooseberries or poha), raw",1.0 cups,,,,15.68,,
5739,"Potatoes, boiled, cooked without skin, flesh, with salt",0.5 cups,,,,15.61,,
5740,"Potatoes, boiled, cooked without skin, flesh, without salt",0.5 cups,,,,15.61,,
5741,"Milk, dry, nonfat, regular, without added vitamin A and vitamin D",0.25 cups,,,,15.59,,
5742,"Potatoes, french fried, cottage-cut, salt not added in processing, frozen, as purchased",10.0 strips,,,,15.59,,
5743,"Squash, summer, zucchini, italian style, canned",1.0 cups,,,,15.55,,
5744,"Snacks, corn-based, extruded, puffs or twists, cheese-flavor",1.0 oz crunchy (about 21 pieces),,,,15.46,,
5745,"Currants, red and white, raw",1.0 cups,,,,15.46,,
5746,"Bread, white, commercially prepared, toasted",1.0 oz,,,,15.45,,
5747,"Soup, beef and vegetables, canned, ready-to-serve",1.0 cups,,,,15.4,,
5748,"Salami, pork, beef, less sodium",3.0 oz,,,,15.38,,
5749,"Biscuits, plain or buttermilk, frozen, baked",1.0 oz,,,,15.27,,
5750,"Gooseberries, raw",1.0 cups,,,,15.27,,
5751,"Cake, coffeecake, creme-filled with chocolate frosting",1.0 oz,,,,15.25,,
5752,"Squash, winter, hubbard, cooked, boiled, mashed, with salt","1.0 cups, mashed",,,,15.25,,
5753,"Squash, winter, hubbard, cooked, boiled, mashed, without salt","1.0 cups, mashed",,,,15.25,,
5754,"Snacks, potato sticks",1.0 oz,,,,15.11,,
5755,"Milk substitutes, fluid, with lauric acid oil",1.0 cups,,,,15.03,,
5756,"Cake, coffeecake, cinnamon with crumb topping, dry mix, prepared",1.0 oz,,,,14.97,,
5757,"Onions, raw","1.0 cups, chopped",,,,14.94,,
5758,"Bread, oatmeal, toasted",1.0 oz,,,,14.94,,
5759,"Peaches, canned, water pack, solids and liquids","1.0 cups, halves or slices",,,,14.91,,
5760,"Chocolate, dark, 60-69% cacao solids",1.0 oz,,,,14.86,,
5761,"Milk, buttermilk, dried",0.25 cups,,,,14.7,,
5762,"Milk, dry, nonfat, calcium reduced",1.0 oz,,,,14.69,,
5763,"Snacks, oriental mix, rice-based",1.0 oz,,,,14.63,,
5764,"Soup, chicken with rice, canned, condensed",0.5 cups,,,,14.58,,
5765,"Ice creams, vanilla, light, no sugar added",1.0 serving 1/2 cups,,,,14.57,,
5766,"Nuts, butternuts, dried",1.0 cups,,,,14.46,,
5767,"Cookies, peanut butter sandwich, special dietary",1.0 oz,,,,14.4,,
5768,"Snacks, potato chips, made from dried potatoes, cheese-flavor",1.0 oz,,,,14.35,,
5769,"Fruit cocktail, (peach and pineapple and pear and grape and cherry), canned, extra light syrup, solids and liquids",0.5 cups,,,,14.3,,
5770,"Cookies, brownies, prepared from recipe",1.0 oz,,,,14.23,,
5771,"Beverages, Orange drink, breakfast type, with juice and pulp, frozen concentrate",1.0 fl oz,,,,14.16,,
5772,"Onions, frozen, whole, cooked, boiled, drained, without salt",1.0 cups,,,,14.07,,
5773,"Apples, raw, without skin",1.0 cups slices,,,,14.04,,
5774,"Bread, cracked-wheat",1.0 oz,,,,14.03,,
5775,"Cheese, parmesan, grated",1.0 cups,,,,13.91,,
5776,"Bagels, oat bran","1.0 mini bagel (2-1/2"" dia)",,,,13.86,,
5777,"Seeds, safflower seed meal, partially defatted",1.0 oz,,,,13.81,,
5778,"Bread, wheat",1.0 slice,,,,13.79,,
5779,"Bagels, plain, enriched, with calcium propionate (includes onion, poppy, sesame), toasted","1.0 mini bagel (2-1/2"" dia)",,,,13.77,,
5780,"Cake, shortcake, biscuit-type, prepared from recipe",1.0 oz,,,,13.75,,
5781,"Dessert topping, powdered, 1.5 ounce prepared with 1/2 cups milk",1.0 cups,,,,13.7,,
5782,"Bread, rye",1.0 oz,,,,13.69,,
5783,"Milk, nonfat, fluid, protein fortified, with added vitamin A and vitamin D (fat free and skim)",1.0 cups,,,,13.68,,
5784,"Bread, whole-wheat, commercially prepared",1.0 slice,,,,13.67,,
5785,"Milk, lowfat, fluid, 1% milkfat, protein fortified, with added vitamin A and vitamin D",1.0 cups,,,,13.58,,
5786,"Milk, reduced fat, fluid, 2% milkfat, protein fortified, with added vitamin A and vitamin D",1.0 cups,,,,13.51,,
5787,"Fish, herring, Atlantic, pickled",1.0 cups,,,,13.5,,
5788,"Biscuits, mixed grain, refrigerated dough",1.0 oz,,,,13.44,,
5789,"Croissants, cheese",1.0 oz,,,,13.32,,
5790,"CAMPBELL'S CHUNKY, Classic Chicken Noodle Soup",1.0 cups,,,,13.15,,
5791,"Milk, sheep, fluid",1.0 cups,,,,13.13,,
5792,"Muffins, English, mixed-grain (includes granola)",1.0 oz,,,,13.13,,
5793,"Potatoes, flesh and skin, raw","0.5 cups, diced",,,,13.12,,
5794,"Beets, raw",1.0 cups,,,,13.0,,
5795,"Beverages, Protein powder soy based",1.0 scoop,,,,13.0,,
5796,"Croissants, butter",1.0 oz,,,,12.98,,
5797,"Danish pastry, cinnamon, enriched",1.0 oz,,,,12.64,,
5798,"Nuts, coconut meat, dried (desiccated), toasted",1.0 oz,,,,12.59,,
5799,"Cereals ready-to-eat, rice, puffed, fortified",1.0 cups,,,,12.57,,
5800,"Bread, reduced-calorie, white",1.0 oz,,,,12.56,,
5801,"Sweeteners, for baking, brown, contains sugar and sucralose",1.0 tbsp,,,,12.53,,
5802,"Bread, protein (includes gluten)",1.0 oz,,,,12.42,,
5803,"Bread, cornbread, prepared from recipe, made with low fat (2%) milk",1.0 oz,,,,12.33,,
5804,"Bread, white wheat",1.0 slice,,,,12.29,,
5805,"Pancakes, plain, frozen, ready-to-heat, microwave (includes buttermilk)",1.0 oz,,,,12.28,,
5806,"Bread, reduced-calorie, oatmeal",1.0 oz,,,,12.28,,
5807,"Figs, raw","1.0 large (2-1/2"" dia)",,,,12.28,,
5808,"Carrots, raw",1.0 cups chopped,,,,12.26,,
5809,"Cheese spread, pasteurized process, American","1.0 cups, diced",,,,12.22,,
5810,"Pie, fried pies, fruit",1.0 oz,,,,12.08,,
5811,"Bread, reduced-calorie, wheat",1.0 oz,,,,12.04,,
5812,"Yogurt, plain, low fat",1.0 container (6 oz),,,,11.97,,
5813,"Soup, cream of chicken, canned, condensed, reduced sodium",0.5 cups,,,,11.78,,
5814,"Cereals ready-to-eat, QUAKER, QUAKER Puffed Wheat",1.0 cups (1 NLEA serving),,,,11.46,,
5815,"Milk, producer, fluid, 3.7% milkfat",1.0 cups,,,,11.35,,
5816,"Bread, oat bran",1.0 oz,,,,11.28,,
5817,"Pie, cherry, commercially prepared",1.0 oz,,,,11.28,,
5818,"Dessert topping, pressurized",1.0 cups,,,,11.25,,
5819,"Gravy, beef, canned, ready-to-serve",1.0 cups,,,,11.21,,
5820,"Alcoholic beverage, liqueur, coffee, 63 proof",1.0 fl oz,,,,11.21,,
5821,"Candies, MOUNDS Candy Bar",1.0 bar snack size,,,,11.19,,
5822,"Onions, sweet, raw",1.0 NLEA serving,,,,11.17,,
5823,"Mountain yam, hawaii, raw","0.5 cups, cubes",,,,11.08,,
5824,"Crackers, melba toast, rye (includes pumpernickel)",0.5 oz,,,,10.98,,
5825,"Cake, cherry fudge with chocolate frosting",1.0 oz,,,,10.77,,
5826,"Squash, summer, crookneck and straightneck, frozen, cooked, boiled, drained, without salt",1.0 cups slices,,,,10.64,,
5827,"Danish pastry, cheese",1.0 oz,,,,10.55,,
5828,"Croissants, apple",1.0 oz,,,,10.52,,
5829,"Chicory roots, raw",1.0 root,,,,10.51,,
5830,"Crackers, rye, wafers, seasoned",0.5 oz,,,,10.48,,
5831,"Croutons, plain",0.5 oz,,,,10.44,,
5832,"POPEYES, Mild Chicken Strips, analyzed 2006",1.0 strip,,,,10.43,,
5833,"Peas, edible-podded, frozen, unprepared",1.0 cups,,,,10.37,,
5834,"Crackers, rusk toast",0.5 oz,,,,10.27,,
5835,"Infant formula, ABBOTT NUTRITION, SIMILAC, GO AND GROW, ready-to-feed, with ARA and DHA",5.0 fl oz,,,,10.24,,
5836,"Nuts, coconut cream, canned, sweetened",1.0 tbsp,,,,10.11,,
5837,"Seeds, sesame flour, low-fat",1.0 oz,,,,10.07,,
5838,"Pie, blueberry, commercially prepared",1.0 oz,,,,9.89,,
5839,"Mollusks, oyster, eastern, cooked, breaded and fried",3.0 oz,,,,9.88,,
5840,"Broccoli, frozen, chopped, cooked, boiled, drained, without salt",1.0 cups,,,,9.84,,
5841,"POPEYES, Spicy Chicken Strips, analyzed 2006",1.0 strip,,,,9.82,,
5842,"Crackers, standard snack-type, regular",5.0 crackers,,,,9.81,,
5843,"Vegetable juice cocktail, canned",1.0 cups,,,,9.79,,
5844,"Cheese food, pasteurized process, American, vitamin D fortified",1.0 cups,,,,9.67,,
5845,"Cheese, cottage, nonfat, uncreamed, dry, large or small curd",1.0 cups (not packed),,,,9.66,,
5846,"Soup, vegetable beef, microwavable, ready-to-serve, single brand",1.0 serving,,,,9.64,,
5847,"Baking chocolate, MARS SNACKFOOD US, M & M's Milk Chocolate Mini Baking Bits","1.0 serving 0.5 oz, about 1 tbsp",,,,9.58,,
5848,"Crackers, saltines, whole wheat (includes multi-grain)",1.0 serving,,,,9.55,,
5849,"Yardlong bean, cooked, boiled, drained, without salt",1.0 cups slices,,,,9.55,,
5850,"Nuts, chestnuts, chinese, boiled and steamed",1.0 oz,,,,9.54,,
5851,"Leeks, (bulb and lower leaf-portion), cooked, boiled, drained, without salt",1.0 leek,,,,9.45,,
5852,"Taro, tahitian, cooked, without salt",1.0 cups slices,,,,9.38,,
5853,"Pie, banana cream, prepared from recipe",1.0 oz,,,,9.33,,
5854,"Baking chocolate, MARS SNACKFOOD US, M & M's Semisweet Chocolate Mini Baking Bits","1.0 serving 0.5 oz, about 1 tbsp",,,,9.23,,
5855,"Croutons, seasoned",0.5 oz,,,,9.02,,
5856,"Cheese, ricotta, whole milk",0.5 cups,,,,9.01,,
5857,"Alcoholic beverage, pina colada, canned",1.0 fl oz,,,,9.0,,
5858,"Edamame, frozen, unprepared",1.0 cups,,,,8.98,,
5859,"Soup, cream of celery, canned, prepared with equal volume water",1.0 cups,,,,8.98,,
5860,"Soup, beef noodle, canned, condensed",0.5 cups,,,,8.95,,
5861,"Carambola, (starfruit), raw","1.0 cups, cubes",,,,8.88,,
5862,"Crackers, standard snack-type, sandwich, with cheese filling",0.5 oz,,,,8.76,,
5863,"Beans, snap, green, frozen, cooked, boiled, drained without salt",1.0 cups,,,,8.71,,
5864,"Cereals, CREAM OF WHEAT, instant, dry",1.0 tbsp,,,,8.68,,
5865,"Tomato juice, canned, without salt added",1.0 cups,,,,8.58,,
5866,"Tomato juice, canned, with salt added",1.0 cups,,,,8.58,,
5867,"Soup, cream of mushroom, canned, condensed",0.5 cups,,,,8.57,,
5868,"Drumstick pods, raw",1.0 cups slices,,,,8.53,,
5869,"Crackers, cheese, regular",0.5 oz,,,,8.44,,
5870,"Cookies, chocolate chip, commercially prepared, regular, higher fat, enriched",1.0 cookie,,,,8.43,,
5871,"Soup, chicken gumbo, canned, condensed",0.5 cups (4 fl oz),,,,8.4,,
5872,"Tomatoes, red, ripe, canned, packed in tomato juice",1.0 cups,,,,8.33,,
5873,"Crackers, standard snack-type, sandwich, with peanut butter filling",0.5 oz,,,,8.29,,
5874,"Crackers, wheat, sandwich, with cheese filling",0.5 oz,,,,8.26,,
5875,"Soup, onion, canned, condensed",0.5 cups (4 fl oz),,,,8.22,,
5876,"Turnip greens, frozen, cooked, boiled, drained, without salt",1.0 cups,,,,8.17,,
5877,"Carrots, canned, regular pack, drained solids","1.0 cups, sliced",,,,8.09,,
5878,"Onions, frozen, whole, unprepared",0.33 package (10 oz),,,,8.03,,
5879,"Hyacinth-beans, immature seeds, cooked, boiled, drained, without salt",1.0 cups,,,,8.0,,
5880,"Soup, cream of shrimp, canned, prepared with equal volume water",1.0 cups,,,,7.98,,
5881,"Yogurt, plain, whole milk",1.0 container (6 oz),,,,7.92,,
5882,"Brussels sprouts, raw",1.0 cups,,,,7.88,,
5883,"Bamboo shoots, raw","1.0 cups (1/2"" slices)",,,,7.85,,
5884,"Tree fern, cooked, without salt","0.5 cups, chopped",,,,7.8,,
5885,"Turnip greens and turnips, frozen, cooked, boiled, drained, with salt",1.0 cups,,,,7.73,,
5886,"Nabisco, Nabisco Oreo Crunchies, Cookie Crumb Topping",1.0 serving,,,,7.73,,
5887,"Chicken, broilers or fryers, meat and skin and giblets and neck, cooked, fried, batter",3.0 oz,,,,7.68,,
5888,"Crackers, wheat, sandwich, with peanut butter filling",0.5 oz,,,,7.64,,
5889,"Beans, kidney, mature seeds, sprouted, raw",1.0 cups,,,,7.54,,
5890,"Beverages, chocolate powder, no sugar added",2.0 tbsp,,,,7.51,,
5891,"Cream, whipped, cream topping, pressurized",1.0 cups,,,,7.49,,
5892,"Broccoli, frozen, chopped, unprepared",1.0 cups,,,,7.46,,
5893,"Peas, edible-podded, raw","1.0 cups, chopped",,,,7.4,,
5894,"Cheese, mozzarella, low moisture, part-skim","1.0 cups, diced",,,,7.37,,
5895,"Cheese, mexican, queso chihuahua","1.0 cups, diced",,,,7.34,,
5896,"Snacks, rice cakes, brown rice, corn",1.0 cake,,,,7.31,,
5897,"Cardoon, raw","1.0 cups, shredded",,,,7.24,,
5898,"Cake, cheesecake, commercially prepared",1.0 oz,,,,7.23,,
5899,"Snacks, rice cakes, brown rice, multigrain",1.0 cake,,,,7.21,,
5900,"Snacks, rice cakes, brown rice, buckwheat",1.0 cake,,,,7.21,,
5901,"Beverages, Whiskey sour mix, bottled",1.0 fl oz,,,,6.91,,
5902,"Whiskey sour mix, bottled, with added potassium and sodium",1.0 fl oz,,,,6.91,,
5903,"Spinach, canned, regular pack, solids and liquids",1.0 cups,,,,6.83,,
5904,"Sausage, chicken, beef, pork, skinless, smoked",1.0 link,,,,6.8,,
5905,"Turnips, frozen, cooked, boiled, drained, without salt",1.0 cups,,,,6.79,,
5906,"Nuts, coconut meat, dried (desiccated), not sweetened",1.0 oz,,,,6.7,,
5907,"Carrots, canned, no salt added, solids and liquids",0.5 cups slices,,,,6.59,,
5908,"Puddings, chocolate, ready-to-eat",1.0 oz,,,,6.52,,
5909,"Onions, frozen, chopped, unprepared",0.33 package (10 oz),,,,6.48,,
5910,"Cheese, ricotta, part skim milk",0.5 cups,,,,6.37,,
5911,"Jute, potherb, cooked, boiled, drained, without salt",1.0 cups,,,,6.34,,
5912,"Okra, frozen, unprepared",0.33 package (10 oz),,,,6.3,,
5913,"Turnip greens, cooked, boiled, drained, without salt","1.0 cups, chopped",,,,6.28,,
5914,"Bread, stuffing, cornbread, dry mix, prepared",1.0 oz,,,,6.21,,
5915,"Soybeans, mature seeds, sprouted, cooked, steamed",1.0 cups,,,,6.14,,
5916,"Collards, frozen, chopped, unprepared",0.33 package (10 oz),,,,6.14,,
5917,"Milk shakes, thick chocolate",1.0 fl oz,,,,6.01,,
5918,"Celery, cooked, boiled, drained, without salt","1.0 cups, diced",,,,6.0,,
5919,"Nuts, mixed nuts, oil roasted, with peanuts, lightly salted",1.0 oz,,,,5.97,,
5920,"Asparagus, canned, drained solids",1.0 cups,,,,5.95,,
5921,"Okra, frozen, cooked, boiled, drained, without salt",0.5 cups slices,,,,5.9,,
5922,"Cheese, feta","1.0 cups, crumbled",,,,5.82,,
5923,"Candies, caramels, chocolate-flavor roll",1.0 piece,,,,5.79,,
5924,"Mollusks, mussel, blue, raw",1.0 cups,,,,5.54,,
5925,"Amaranth leaves, cooked, boiled, drained, without salt",1.0 cups,,,,5.43,,
5926,"Candies, truffles, prepared-from-recipe",1.0 piece,,,,5.39,,
5927,"Cheese, cottage, lowfat, 2% milkfat",4.0 oz,,,,5.38,,
5928,"Mushrooms, portabella, grilled",1.0 cups sliced,,,,5.37,,
5929,"Infant formula, ABBOTT NUTRITION, SIMILAC, For Spit Up, powder, with ARA and DHA",1.0 scoop,,,,5.22,,
