,Description,Measure,"Fatty acids, total polyunsaturated(g)Per Measure","Fiber, total dietary(g)Per 100 g","Fatty acids, total saturated(g)Per Measure","Carbohydrate, by difference(g)Per Measure","Sugars, total(g)Per Measure",Protein(g)Per Measure
0,"Nuts, butternuts, dried",1.0 cups,51.289,,,,,
1,"Seeds, sunflower seed kernels, toasted, without salt",1.0 cups,50.259,,,,,
2,"Seeds, sunflower seed kernels, oil roasted, without salt",1.0 cups,46.297,,,,,
3,"Peanuts, valencia, oil-roasted, without salt",1.0 cups,25.592,,,,,
4,"Seeds, pumpkin and squash seed kernels, roasted, with salt added",1.0 cups,23.43,,,,,
5,"Nuts, almonds, dry roasted, without salt added",1.0 cups whole kernels,17.878,,,,,
6,"Snacks, trail mix, regular, with chocolate chips, unsalted nuts and seeds",1.0 cups,16.483,,,,,
7,"Peanuts, all types, dry-roasted, without salt",1.0 cups,14.269,,,,,
8,"Chicken, skin (drumsticks and thighs), raw",4.0 oz,10.233,,,,,
9,"Oil, safflower, salad or cooking, linoleic, (over 70%)",1.0 tbsp,10.149,,,,,
10,"Cereals ready-to-eat, granola, homemade",1.0 cups,9.527,,,,,
11,"Nuts, hazelnuts or filberts","1.0 cups, chopped",9.108,,,,,
12,"Soybeans, green, raw",1.0 cups,8.192,,,,,
13,"Pie crust, deep dish, frozen, unbaked, made with enriched flour",1.0 pie crust (average weight),7.942,,,,,
14,"Pie crust, deep dish, frozen, baked, made with enriched flour",1.0 pie crust (average weight),7.914,,,,,
15,"Salad dressing, mayonnaise, soybean and safflower oil, with salt",1.0 tablespoon,7.59,,,,,
16,"Fast foods, biscuit, with egg and bacon",1.0 biscuit,7.47,,,,,
17,"Fast foods, croissant, with egg, cheese, and sausage",1.0 sandwich,7.203,,,,,
18,"Desserts, mousse, chocolate, prepared-from-recipe",1.0 recipe yield,7.102,,,,,
19,"POPEYES, Coleslaw",1.0 package,7.022,,,,,
20,"Oil, soybean, salad or cooking, (partially hydrogenated) and cottonseed",1.0 tablespoon,6.542,,,,,
21,"Tofu, raw, firm, prepared with calcium sulfate",0.5 cups,6.2,,,,,
22,"Salad dressing, mayonnaise, regular",1.0 tbsp,6.167,,,,,
23,"Oil, sesame, salad or cooking",1.0 tablespoon,5.671,,,,,
24,"Soybeans, green, cooked, boiled, drained, without salt",1.0 cups,5.42,,,,,
25,"Snacks, potato chips, made from dried potatoes, cheese-flavor",1.0 oz,5.29,,,,,
26,"Shortening bread, soybean (hydrogenated) and cottonseed",1.0 tablespoon,5.197,,,,,
27,"Bread, pound cake type, pan de torta salvadoran",1.0 serving,5.183,,,,,
28,"Turkey, all classes, back, meat and skin, cooked, roasted","1.0 cups, chopped or diced",5.18,,,,,
29,"Snacks, corn-based, extruded, puffs or twists, cheese-flavor",1.0 oz crunchy (about 21 pieces),5.084,,,,,
30,"Snacks, potato sticks",1.0 oz,5.075,,,,,
31,"Fast Foods, biscuit, with egg and sausage",1.0 item,4.807,,,,,
32,"Salad dressing, french, home recipe",1.0 tablespoon,4.718,,,,,
33,"Cream puff, eclair, custard or cream filled, iced",4.0 oz,4.715,,,,,
34,"Bread, cheese",1.0 slice,4.417,,,,,
35,"Nuts, mixed nuts, oil roasted, with peanuts, lightly salted",1.0 oz,4.143,,,,,
36,"Oil, canola",1.0 tbsp,3.94,,,,,
37,"Chicken, broilers or fryers, dark meat, meat only, cooked, fried",1.0 cups,3.878,,,,,
38,"Snacks, tortilla chips, ranch-flavor",1.0 oz,3.835,,,,,
39,"Salad dressing, sesame seed dressing, regular",1.0 tablespoon,3.765,,,,,
40,"Pie Crust, Cookie-type, Chocolate, Ready Crust",1.0 crust,3.704,,,,,
41,"Soup, cream of mushroom, canned, condensed",0.5 cups,3.655,,,,,
42,"Chicken, broilers or fryers, back, meat and skin, raw",1.0 unit (yield from 1 lb ready-to-cook chicken),3.623,,,,,
43,"Corn grain, white",1.0 cups,3.591,,,,,
44,"Chicken, broilers or fryers, dark meat, meat and skin, cooked, stewed",1.0 unit (yield from 1 lb ready-to-cook chicken),3.564,,,,,
45,"Chicken, broilers or fryers, meat and skin and giblets and neck, cooked, fried, batter",3.0 oz,3.528,,,,,
46,"Oat flour, partially debranned",1.0 cups,3.462,,,,,
47,"Snacks, potato chips, barbecue-flavor",1.0 oz,3.461,,,,,
48,"Candies, confectioner's coating, peanut butter",1.0 cups chips,3.449,,,,,
49,"Cookies, peanut butter sandwich, special dietary",1.0 oz,3.409,,,,,
50,"Margarine-like, margarine-butter blend, soybean oil and butter",1.0 tbsp,3.408,,,,,
51,"Chicken, broilers or fryers, drumstick, meat and skin, cooked, stewed","1.0 cups, chopped or diced",3.332,,,,,
52,"Salami, pork, beef, less sodium",3.0 oz,3.067,,,,,
53,"Cookies, sugar wafer, with creme filling, sugar free",1.0 oz,3.047,,,,,
54,"Turkey, ground, 93% lean, 7% fat, pan-broiled crumbles",3.0 oz,3.028,,,,,
55,"Snacks, oriental mix, rice-based",1.0 oz,3.017,,,,,
56,"Oil, mustard",1.0 tbsp,2.972,,,,,
57,"Chicken, broilers or fryers, meat and skin, cooked, fried, flour",3.0 oz,2.899,,,,,
58,"Crackers, wheat, regular",16.0 crackers 1 serving,2.881,,,,,
59,"Mollusks, oyster, eastern, cooked, breaded and fried",3.0 oz,2.816,,,,,
60,"Pie, Dutch Apple, Commercially Prepared","0.12 pie 1 pie (1/8 of 9"" pie)",2.773,,,,,
61,"Pork, fresh, shoulder, whole, separable lean and fat, cooked, roasted","1.0 cups, diced",2.768,,,,,
62,"DIGIORNO Pizza, cheese topping, rising crust, frozen, baked",1.0 slice 1/4 of pie,2.674,,,,,
63,"Cookies, brownies, prepared from recipe",1.0 oz,2.668,,,,,
64,"POPEYES, biscuit",1.0 biscuit,2.627,,,,,
65,"Cake, chocolate, prepared from recipe without frosting","1.0 piece (1/12 of 9"" dia)",2.623,,,,,
66,"Squab, (pigeon), meat and skin, raw",3.0 oz,2.609,,,,,
67,"Pork sausage, link/patty, reduced fat, unprepared",3.0 oz,2.571,,,,,
68,"Sausage, pork and turkey, pre-cooked",1.0 serving,2.567,,,,,
69,"Soup, cream of celery, canned, prepared with equal volume water",1.0 cups,2.554,,,,,
70,"Fish, tuna, white, canned in oil, drained solids",3.0 oz,2.526,,,,,
71,"Turkey, retail parts, thigh, meat and skin, cooked, roasted",3.0 oz,2.507,,,,,
72,"Turkey, whole, dark meat, meat and skin, cooked, roasted",3.0 oz,2.437,,,,,
73,"Bread, salvadoran sweet cheese (quesadilla salvadorena)",1.0 serving (approximate serving size),2.435,,,,,
74,"Cake, yellow, prepared from recipe without frosting","1.0 piece (1/12 of 8"" dia)",2.428,,,,,
75,"Biscuits, plain or buttermilk, dry mix","1.0 cups, purchased",2.413,,,,,
76,"Soybeans, mature seeds, sprouted, cooked, steamed",1.0 cups,2.362,,,,,
77,"Cookies, shortbread, commercially prepared, plain",1.0 oz,2.36,,,,,
78,"Fish, herring, Atlantic, pickled",1.0 cups,2.351,,,,,
79,"Garlic bread, frozen",1.0 slice presliced,2.338,,,,,
80,"Turkey, all classes, leg, meat and skin, cooked, roasted",3.0 oz,2.312,,,,,
81,"Fast foods, croissant, with egg, cheese, and ham",1.0 item,2.302,,,,,
82,"Frankfurter, meat",1.0 serving (1 hot dog),2.29,,,,,
83,"Pork, fresh, leg (ham), whole, separable lean and fat, raw",4.0 oz,2.271,,,,,
84,"Cookies, chocolate sandwich, with creme filling, special dietary",1.0 oz,2.245,,,,,
85,"Cornmeal, white, self-rising, bolted, with wheat flour added, enriched",1.0 cups,2.205,,,,,
86,"Chicken, stewing, meat and skin, and giblets and neck, cooked, stewed",3.0 oz,2.196,,,,,
87,"Potatoes, mashed, dehydrated, prepared from granules with milk, water and margarine added",1.0 cups,2.194,,,,,
88,"Fast foods, english muffin, with egg, cheese, and canadian bacon",1.0 sandwich,2.186,,,,,
89,"Nuts, almond butter, plain, with salt added",1.0 tbsp,2.178,,,,,
90,"Fish, salmon, coho, wild, cooked, moist heat",3.0 oz,2.143,,,,,
91,"Cookies, vanilla sandwich with creme filling",1.0 oz,2.141,,,,,
92,"Candies, fudge, chocolate, with nuts, prepared-from-recipe",1.0 oz,2.134,,,,,
93,"Puddings, banana, dry mix, regular, with added oil",1.0 package (3.12 oz),2.121,,,,,
94,"Sausage, pork and beef, with cheddar cheese, smoked",12.0 oz serving 2.7 oz,2.106,,,,,
95,"Crackers, standard snack-type, regular",5.0 crackers,2.102,,,,,
96,"Fish, herring, Pacific, raw",3.0 oz,2.06,,,,,
97,"Pork, fresh, loin, country-style ribs, separable lean and fat, bone-in, cooked, broiled",3.0 oz,2.021,,,,,
98,"Cornmeal, whole-grain, white",1.0 cups,1.998,,,,,
99,"Corn flour, yellow, masa, enriched",1.0 cups,1.965,,,,,
100,"Cheese substitute, mozzarella","1.0 cups, shredded",1.964,,,,,
101,"Cookies, oatmeal, commercially prepared, special dietary",1.0 oz,1.923,,,,,
102,"Cookies, chocolate chip, commercially prepared, regular, lower fat",1.0 serving 3 cookies,1.918,,,,,
103,"Candies, NESTLE, BUTTERFINGER Bar",1.0 serving 2.1 oz bar,1.898,,,,,
104,"Candies, 5TH AVENUE Candy Bar",1.0 bar 2 oz,1.898,,,,,
105,"Cream, fluid, heavy whipping","1.0 cups, whipped",1.884,,,,,
106,"Lamb, rib, separable lean and fat, trimmed to 1/8"" fat, choice, cooked, broiled",3.0 oz,1.844,,,,,
107,"Chicken, broilers or fryers, separable fat, raw",1.0 tbsp,1.818,,,,,
108,"Salad dressing, mayonnaise type, regular, with salt",1.0 tbsp,1.791,,,,,
109,"Cheese, swiss","1.0 cups, diced",1.77,,,,,
110,"Beef, Australian, imported, grass-fed, seam fat, raw",4.0 oz,1.754,,,,,
111,"Fish, salmon, pink, canned, without salt, solids with bone and liquid",3.0 oz,1.742,,,,,
112,"Chicken, broiler, rotisserie, BBQ, back meat only",3.0 oz,1.737,,,,,
113,"Cookies, oatmeal, with raisins",1.0 oz,1.727,,,,,
114,"Heinz, Weight Watcher, Chocolate Eclair, frozen","1.0 eclair, frozen",1.711,,,,,
115,"Bologna, pork and turkey, lite",1.0 serving 2 oz,1.709,,,,,
116,"Pork, fresh, shoulder, (Boston butt), blade (steaks), separable lean and fat, with added solution, cooked, braised",3.0 oz,1.705,,,,,
117,"Sorghum flour, whole-grain",1.0 cups,1.698,,,,,
118,"Frankfurter, pork",1.0 link,1.697,,,,,
119,"Lamb, rib, separable lean and fat, trimmed to 1/8"" fat, choice, cooked, roasted",3.0 oz,1.692,,,,,
120,"Lamb, shoulder, blade, separable lean and fat, trimmed to 1/8"" fat, choice, cooked, braised",3.0 oz,1.674,,,,,
121,"Chicken, broilers or fryers, back, meat only, raw",4.0 oz,1.661,,,,,
122,"Sauce, cheese, ready-to-serve",0.25 cups,1.637,,,,,
123,"Pork, fresh, shoulder, (Boston butt), blade (steaks), separable lean and fat,with added solution, raw",4.0 oz,1.62,,,,,
124,"Pork sausage, link/patty, fully cooked, unheated",1.0 link,1.591,,,,,
125,"Fish, bluefish, raw",1.0 fillet,1.59,,,,,
126,"Salad dressing, mayonnaise, imitation, soybean",1.0 tbsp,1.59,,,,,
127,"Fish, bluefish, cooked, dry heat",1.0 fillet,1.589,,,,,
128,"Chicken, broilers or fryers, leg, meat and skin, cooked, roasted",3.0 oz,1.577,,,,,
129,"Rice flour, brown",1.0 cups,1.574,,,,,
130,"Pork, fresh, loin, blade (chops or roasts), boneless, separable lean and fat only, raw",4.0 oz,1.548,,,,,
131,"Pie, fried pies, fruit",1.0 oz,1.524,,,,,
132,"Bologna, meat and poultry",1.0 slice,1.515,,,,,
133,"Pork, fresh, shoulder, blade, boston (roasts), separable lean and fat, cooked, roasted",3.0 oz,1.496,,,,,
134,"Egg, whole, cooked, fried",1.0 large,1.495,,,,,
135,"Luncheon meat, pork, ham, and chicken, minced, canned, reduced sodium, added ascorbic acid, includes SPAM, 25% less sodium",2.0 oz 1 NLEA serving,1.493,,,,,
136,"Fish, mackerel, spanish, raw",3.0 oz,1.478,,,,,
137,"Lamb, loin, separable lean and fat, trimmed to 1/8"" fat, choice, cooked, roasted",3.0 oz,1.437,,,,,
138,"Crackers, cheese, regular",0.5 oz,1.433,,,,,
139,"Oil, olive, salad or cooking",1.0 tablespoon,1.421,,,,,
140,"Cheese, parmesan, grated",1.0 cups,1.386,,,,,
141,"Pork, fresh, loin, blade (roasts), boneless, separable lean and fat, cooked, roasted",3.0 oz,1.369,,,,,
142,"Sausage, turkey, fresh, raw",1.0 serving,1.36,,,,,
143,"Soup, chicken, canned, chunky, ready-to-serve",1.0 cups,1.347,,,,,
144,"Cheese, mozzarella, low moisture, part-skim","1.0 cups, diced",1.345,,,,,
145,"Lamb, shoulder, blade, separable lean and fat, trimmed to 1/8"" fat, choice, cooked, roasted",3.0 oz,1.343,,,,,
146,Liverwurst spread,0.25 cups,1.335,,,,,
147,"Bologna, chicken, turkey, pork",1.0 serving,1.308,,,,,
148,"Kielbasa, Polish, turkey and beef, smoked",1.0 serving 2 oz,1.305,,,,,
149,"Candies, NESTLE, BUTTERFINGER Crisp",1.0 piece,1.302,,,,,
150,"Crackers, wheat, sandwich, with cheese filling",0.5 oz,1.302,,,,,
151,"Cookies, brownies, dry mix, sugar free",1.0 oz,1.298,,,,,
152,"Nuts, chestnuts, european, raw, unpeeled",1.0 cups,1.296,,,,,
153,"Cookies, chocolate sandwich, with creme filling, regular",3.0 cookie,1.282,,,,,
154,"Fish, salmon, pink, canned, drained solids",3.0 oz,1.281,,,,,
155,"Fish, trout, rainbow, farmed, cooked, dry heat",1.0 fillet,1.277,,,,,
156,"Pork, fresh, loin, sirloin (roasts), bone-in, separable lean and fat, cooked, roasted",3.0 oz,1.274,,,,,
157,"Crackers, wheat, sandwich, with peanut butter filling",0.5 oz,1.258,,,,,
158,"Pork, fresh, variety meats and by-products, brain, cooked, braised",3.0 oz,1.25,,,,,
159,"MORI-NU, Tofu, silken, firm",1.0 slice,1.247,,,,,
160,"Cheese, cheddar (Includes foods for USDA's Food Distribution Program)","1.0 cups, diced",1.243,,,,,
161,"Chicken, broilers or fryers, leg, meat only, cooked, fried",1.0 unit (yield from 1 lb ready-to-cook chicken),1.243,,,,,
162,"Lamb, shoulder, arm, separable lean and fat, trimmed to 1/8"" fat, cooked, broiled",3.0 oz,1.241,,,,,
163,"Frostings, coconut-nut, ready-to-eat",0.08 package,1.24,,,,,
164,"Pork, fresh, loin, center rib (roasts), bone-in, separable lean only, cooked, roasted",3.0 oz,1.235,,,,,
165,"Pork, fresh, variety meats and by-products, feet, raw",4.0 oz,1.234,,,,,
166,"Beverages, Protein powder soy based",1.0 scoop,1.215,,,,,
167,"Pasta, fresh-refrigerated, plain, as purchased",4.0 oz,1.206,,,,,
168,Bacon and beef sticks,1.0 oz,1.204,,,,,
169,"Snacks, granola bars, soft, uncoated, peanut butter",1.0 bar (1 oz),1.196,,,,,
170,"Fish, trout, mixed species, cooked, dry heat",1.0 fillet,1.192,,,,,
171,"Cheese food, pasteurized process, American, vitamin D fortified",1.0 cups,1.185,,,,,
172,"Biscuits, plain or buttermilk, frozen, baked",1.0 oz,1.184,,,,,
173,"Beans, black, mature seeds, raw",1.0 cups,1.183,,,,,
174,"Cheese, mexican, queso chihuahua","1.0 cups, diced",1.177,,,,,
175,"Cookies, chocolate wafers",1.0 oz,1.177,,,,,
176,"Cookies, shortbread, commercially prepared, pecan",1.0 oz,1.169,,,,,
177,"Beerwurst, beer salami, pork and beef",2.0 oz,1.165,,,,,
178,"Beerwurst, pork and beef",1.0 serving 2 oz,1.165,,,,,
179,"Fish, swordfish, cooked, dry heat",3.0 oz,1.163,,,,,
180,"Pork, cured, ham, shank, bone-in, separable lean and fat, unheated",3.0 oz,1.161,,,,,
181,"Pork, cured, ham, rump, bone-in, separable lean and fat, unheated",3.0 oz,1.153,,,,,
182,"Pork, fresh, leg (ham), whole, separable lean only, cooked, roasted","1.0 cups, diced",1.147,,,,,
183,Barley flour or meal,1.0 cups,1.141,,,,,
184,"Snacks, KELLOGG, KELLOGG'S RICE KRISPIES TREATS Squares",1.0 serving,1.122,,,,,
185,"Egg, yolk, raw, frozen, sugared, pasteurized",1.0 oz,1.093,,,,,
186,"Cookies, chocolate chip, commercially prepared, regular, higher fat, enriched",1.0 cookie,1.086,,,,,
187,"Cookies, peanut butter sandwich, regular",1.0 oz,1.076,,,,,
188,"Pork, fresh, loin, country-style ribs, separable lean only, bone-in, cooked, broiled",3.0 oz,1.073,,,,,
189,"Lamb, New Zealand, imported, frozen, shoulder, whole (arm and blade), separable lean and fat, trimmed to 1/8"" fat, cooked, braised",3.0 oz,1.062,,,,,
190,"Cookies, sugar, commercially prepared, regular (includes vanilla)",1.0 oz,1.062,,,,,
191,"Cream, fluid, light whipping","1.0 cups, whipped",1.061,,,,,
192,"Tortillas, ready-to-bake or -fry, flour, shelf stable",1.0 tortilla,1.054,,,,,
193,"Soup, black bean, canned, condensed",1.0 cups (8 fl oz),1.054,,,,,
194,"Lamb, Australian, imported, fresh, rib chop, frenched, bone-in, separable lean and fat, trimmed to 1/8"" fat, cooked, grilled",3.0 oz,1.045,,,,,
195,"Soup, chicken noodle, dry, mix",1.0 packet,1.035,,,,,
196,"Pasta, whole-wheat, dry (Includes foods for USDA's Food Distribution Program)",1.0 cups spaghetti,1.034,,,,,
197,"Cake, shortcake, biscuit-type, prepared from recipe",1.0 oz,1.03,,,,,
198,"Cookies, peanut butter, commercially prepared, regular",1.0 oz,1.023,,,,,
199,"Corn, sweet, yellow, canned, drained solids, rinsed with tap water","1.0 cups drained, rinsed",1.023,,,,,
200,"Beans, pink, mature seeds, raw",1.0 cups,1.023,,,,,
201,"Snacks, crisped rice bar, chocolate chip",1.0 bar (1 oz),1.022,,,,,
202,"Pork, fresh, loin, whole, separable lean and fat, cooked, broiled",3.0 oz,1.02,,,,,
203,"Cornmeal, white, self-rising, degermed, enriched",1.0 cups,1.02,,,,,
204,"Cheese, provolone","1.0 cups, diced",1.015,,,,,
205,"Crackers, saltines, whole wheat (includes multi-grain)",1.0 serving,1.012,,,,,
206,"Salami, Italian, pork",1.0 oz,1.008,,,,,
207,"Bread, cornbread, dry mix, prepared with 2% milk, 80% margarine, and eggs",1.0 muffin,1.001,,,,,
208,"Pie, blueberry, commercially prepared",1.0 oz,0.999,,,,,
209,Hormel Pillow Pak Sliced Turkey Pepperoni,1.0 serving,0.996,,,,,
210,"Wheat flour, white, bread, enriched",1.0 cups,0.996,,,,,
211,"Fish, salmon, chum, cooked, dry heat",3.0 oz,0.979,,,,,
212,"Snacks, pork skins, barbecue-flavor",1.0 oz,0.978,,,,,
213,"Passion-fruit, (granadilla), purple, raw",1.0 cups,0.97,,,,,
214,"Muffin, blueberry, commercially prepared, low-fat",1.0 muffin small,0.968,,,,,
215,"Fish, roe, mixed species, cooked, dry heat",1.0 oz,0.965,,,,,
216,"Bread, pan dulce, sweet yeast bread",1.0 slice (average weight of 1 slice),0.964,,,,,
217,"Egg, whole, raw, fresh",1.0 large,0.956,,,,,
218,"Cookies, sugar wafers with creme filling, regular",3.0 cookies,0.954,,,,,
219,"Cereals ready-to-eat, POST, HONEY BUNCHES OF OATS with vanilla bunches",1.0 cups (1 NLEA serving),0.952,,,,,
220,"Veal, breast, whole, boneless, separable lean and fat, cooked, braised",3.0 oz,0.952,,,,,
221,"Egg, whole, cooked, poached",1.0 large,0.952,,,,,
222,"Beverages, UNILEVER, SLIMFAST, meal replacement, regular, ready-to-drink,  3-2-1 Plan",1.0 bottle,0.944,,,,,
223,"Cereals, QUAKER, Instant Oatmeal Organic, Regular",1.0 packet,0.943,,,,,
224,"Pie, banana cream, prepared from recipe",1.0 oz,0.933,,,,,
225,"Pork, fresh, shoulder, blade, boston (steaks), separable lean only, cooked, broiled",3.0 oz,0.918,,,,,
226,"Beef, rib, small end (ribs 10-12), separable lean and fat, trimmed to 1/8"" fat, choice, cooked, roasted",3.0 oz,0.909,,,,,
227,"Mollusks, mussel, blue, raw",1.0 cups,0.909,,,,,
228,"Bread, cornbread, prepared from recipe, made with low fat (2%) milk",1.0 oz,0.909,,,,,
229,"Crackers, cheese, sandwich-type with cheese filling",6.0 cracker 1 cracker = 6.5g,0.908,,,,,
230,"Pork, cured, ham with natural juices, spiral slice, boneless, separable lean and fat, heated, roasted",1.0 slice,0.906,,,,,
231,"Braunschweiger (a liver sausage), pork",1.0 oz,0.905,,,,,
232,"Cereals ready-to-eat, NATURE'S PATH, Organic FLAX PLUS flakes",0.75 cups (1 NLEA serving),0.903,,,,,
233,"Cake, white, dry mix, special dietary (includes lemon-flavored)",1.0 oz,0.902,,,,,
234,"Cookies, peanut butter, commercially prepared, soft-type",1.0 oz,0.902,,,,,
235,"Mollusks, oyster, eastern, wild, cooked, moist heat",3.0 oz,0.898,,,,,
236,"Cake, coffeecake, cinnamon with crumb topping, dry mix, prepared",1.0 oz,0.897,,,,,
237,"Snacks, corn-based, extruded, onion-flavor",1.0 oz,0.89,,,,,
238,"Cheese, feta","1.0 cups, crumbled",0.886,,,,,
239,"Noodles, egg, unenriched, cooked, without added salt",1.0 cups,0.883,,,,,
240,"Sausage, turkey, hot, smoked",2.0 oz,0.88,,,,,
241,"Cheese spread, pasteurized process, American","1.0 cups, diced",0.874,,,,,
242,"Cheese, muenster","1.0 cups, diced",0.873,,,,,
243,"Cheese, pasteurized process, swiss","1.0 cups, diced",0.871,,,,,
244,"Chicken, dark meat, thigh, meat only, with added solution, raw",4.0 oz,0.867,,,,,
245,"Blackberry juice, canned",1.0 cups,0.86,,,,,
246,"Cheese, mozzarella, whole milk","1.0 cups, shredded",0.857,,,,,
247,"Soup, beef and vegetables, canned, ready-to-serve",1.0 cups,0.855,,,,,
248,"Cereals ready-to-eat, QUAKER Oatmeal Squares, Golden Maple",1.0 cups (1 NLEA serving),0.853,,,,,
249,"Cookies, oatmeal, refrigerated dough, baked",1.0 oz,0.844,,,,,
250,"Tomato products, canned, sauce, with onions, green peppers, and celery",1.0 cups,0.843,,,,,
251,"Lamb, New Zealand, imported, frozen, loin, separable lean and fat, trimmed to 1/8"" fat, cooked, broiled",3.0 oz,0.842,,,,,
252,"Danish pastry, cinnamon, enriched",1.0 oz,0.832,,,,,
253,"Veal, breast, separable fat, cooked",1.0 oz,0.812,,,,,
254,"Lamb, Australian, imported, fresh, separable fat, raw",1.0 oz,0.806,,,,,
255,"Beef, tenderloin, steak, separable lean and fat, trimmed to 1/8"" fat, select, raw",4.0 oz,0.793,,,,,
256,"Fish, seatrout, mixed species, cooked, dry heat",3.0 oz,0.79,,,,,
257,"Cookies, fig bars",1.0 oz,0.786,,,,,
258,"Beef, short loin, porterhouse steak, separable lean and fat, trimmed to 1/8"" fat, choice, raw",4.0 oz,0.779,,,,,
259,"Bread, stuffing, cornbread, dry mix, prepared",1.0 oz,0.767,,,,,
260,"Archway Home Style Cookies, Iced Oatmeal",1.0 serving,0.762,,,,,
261,"Crackers, cream, Gamesa Sabrosas",11.0 crackers (1 NLEA serving),0.76,,,,,
262,"Milk, sheep, fluid",1.0 cups,0.755,,,,,
263,"Pork, ground, 96% lean / 4% fat, raw",4.0 oz,0.746,,,,,
264,"Cookies, oatmeal, refrigerated dough",1.0 oz,0.735,,,,,
265,"Danish pastry, cheese",1.0 oz,0.73,,,,,
266,"Infant formula, ABBOTT NUTRITION, SIMILAC, GO AND GROW, ready-to-feed, with ARA and DHA",5.0 fl oz,0.728,,,,,
267,"Cookies, oatmeal, commercially prepared, regular",1.0 oz,0.721,,,,,
268,"Fish, wolffish, Atlantic, raw",3.0 oz,0.718,,,,,
269,"Cereals, oats, instant, fortified, with raisins and spice, prepared with water",1.0 cups,0.718,,,,,
270,"Cookies, chocolate chip, refrigerated dough",1.0 serving,0.717,,,,,
271,"Bologna, pork, turkey and beef",1.0 oz,0.712,,,,,
272,"Sausage, chicken, beef, pork, skinless, smoked",1.0 link,0.711,,,,,
273,"Lamb, Australian, imported, fresh, shoulder, arm, separable lean and fat, trimmed to 1/8"" fat, cooked, braised",3.0 oz,0.706,,,,,
274,"Pork, fresh, variety meats and by-products, pancreas, raw",1.0 oz,0.703,,,,,
275,"Cookies, chocolate sandwich, with extra creme filling",1.0 oz,0.701,,,,,
276,"Mollusks, oyster, eastern, wild, cooked, dry heat",3.0 oz,0.697,,,,,
277,"Beef, chuck, short ribs, boneless, separable lean only, trimmed to 0"" fat, choice, cooked, braised",3.0 oz,0.689,,,,,
278,"Asparagus, canned, drained solids",1.0 cups,0.687,,,,,
279,"Archway Home Style Cookies, Iced Molasses",1.0 serving,0.683,,,,,
280,"Keebler, Keebler Chocolate Graham SELECTS",1.0 serving,0.682,,,,,
281,"Veal, Australian, shank, hind, bone-in, separable lean only, raw",4.0 oz,0.68,,,,,
282,"POPEYES, Mild Chicken Strips, analyzed 2006",1.0 strip,0.679,,,,,
283,"Croissants, cheese",1.0 oz,0.676,,,,,
284,"Veal, breast, whole, boneless, separable lean only, cooked, braised",3.0 oz,0.67,,,,,
285,"Cake, cherry fudge with chocolate frosting",1.0 oz,0.663,,,,,
286,"Pork, ground, 96% lean / 4% fat, cooked, crumbles",3.0 oz grilled patties,0.66,,,,,
287,"Toaster pastries, fruit, toasted (include apple, blueberry, cherry, strawberry)",1.0 pastry,0.653,,,,,
288,"Soup, onion, canned, condensed",0.5 cups (4 fl oz),0.652,,,,,
289,"Beef, loin, top loin, separable lean and fat, trimmed to 1/8"" fat, select, raw",4.0 oz,0.646,,,,,
290,"Crackers, standard snack-type, sandwich, with peanut butter filling",0.5 oz,0.646,,,,,
291,"Turkey, ground, fat free, patties, broiled",3.0 oz,0.645,,,,,
292,"Fish, cisco, smoked",1.0 oz,0.645,,,,,
293,"Crustaceans, spiny lobster, mixed species, cooked, moist heat",3.0 oz,0.643,,,,,
294,"Cereals ready-to-eat, POST, Shredded Wheat, original spoon-size",1.0 cups (1 NLEA serving),0.637,,,,,
295,"Lamb, New Zealand, imported, frozen, foreshank, separable lean and fat, trimmed to 1/8"" fat, cooked, braised",3.0 oz,0.62,,,,,
296,"Game meat, bison, ground, cooked, pan-broiled",1.0 patty ( yield from 112.7 g raw meat ),0.619,,,,,
297,"Cereals, WHEATENA, cooked with water",1.0 cups,0.612,,,,,
298,"Puddings, lemon, dry mix, regular, with added oil, potassium, sodium",1.0 package (3 oz),0.612,,,,,
299,"Fish, herring, Atlantic, raw","1.0 oz, boneless",0.605,,,,,
300,"Pasta, fresh-refrigerated, spinach, as purchased",4.0 oz,0.598,,,,,
301,"Candies, NESTLE, 100 GRAND Bar",1.0 bar (1.5 oz),0.597,,,,,
302,"Corn, sweet, yellow, canned, brine pack, regular pack, solids and liquids",1.0 cups,0.596,,,,,
303,"Snacks, tortilla chips, nacho-flavor, reduced fat",1.0 oz,0.595,,,,,
304,"Beef, chuck eye roast, boneless, America's Beef Roast, separable lean and fat, trimmed to 0"" fat, all grades, raw",4.0 oz,0.594,,,,,
305,"Pork, cured, ham and water product, slice, boneless, separable lean and fat, heated, pan-broil",3.0 oz (3 oz),0.594,,,,,
306,"Bread, white, commercially prepared, toasted",1.0 oz,0.593,,,,,
307,"Infant formula, ABBOTT NUTRITION, SIMILAC, For Spit Up, powder, with ARA and DHA",1.0 scoop,0.591,,,,,
308,"POPEYES, Spicy Chicken Strips, analyzed 2006",1.0 strip,0.589,,,,,
309,"Pork, fresh, loin, blade (chops or roasts), boneless, separable lean only, raw",4.0 oz,0.588,,,,,
310,"Candies, HERSHEY'S, ALMOND JOY BITES",18.0 pieces,0.584,,,,,
311,"Fish, flatfish (flounder and sole species), cooked, dry heat",1.0 fillet,0.583,,,,,
312,"Pie, cherry, commercially prepared",1.0 oz,0.583,,,,,
313,"Lamb, New Zealand, imported, frozen, leg, whole (shank and sirloin), separable lean and fat, trimmed to 1/8"" fat, cooked, roasted",3.0 oz,0.578,,,,,
314,"Soup, pea, split with ham, canned, chunky, ready-to-serve",1.0 cups,0.576,,,,,
315,"Cereals ready-to-eat, POST, Shredded Wheat, original big biscuit",2.0 biscuits (1 NLEA serving),0.573,,,,,
316,"Soup, bean with bacon, condensed, single brand",1.0 serving 1/2 cups,0.571,,,,,
317,"Pork, fresh, loin, tenderloin, separable lean and fat, with added solution, raw",4.0 oz,0.568,,,,,
318,"Pork, fresh, loin, blade (chops), boneless, separable lean only, boneless, cooked, broiled",3.0 oz,0.568,,,,,
319,"Focaccia, Italian flatbread, plain",1.0 piece,0.567,,,,,
320,"Peas and carrots, frozen, cooked, boiled, drained, without salt",1.0 package (10 oz) yields,0.559,,,,,
321,"Noodles, egg, spinach, enriched, cooked",1.0 cups,0.558,,,,,
322,"Bratwurst, pork, beef and turkey, lite, smoked",1.0 serving 2.33 oz,0.558,,,,,
